09:08:09.788271 IP clnode190.clemson.cloudlab.us.50700 > 104.46.115.237.8883: Flags [S], seq 1640007775, win 64240, options [mss 1460,sackOK,TS val 549647683 ecr 0,nop,wscale 7], length 0
09:08:09.808607 IP 104.46.115.237.8883 > clnode190.clemson.cloudlab.us.50700: Flags [S.], seq 1780143468, ack 1640007776, win 65535, options [mss 1440,nop,wscale 8,nop,nop,sackOK], length 0
09:08:09.808649 IP clnode190.clemson.cloudlab.us.50700 > 104.46.115.237.8883: Flags [.], ack 1, win 502, length 0
09:08:09.809081 IP clnode190.clemson.cloudlab.us.50700 > 104.46.115.237.8883: Flags [P.], seq 1:294, ack 1, win 502, length 293
09:08:09.830470 IP 104.46.115.237.8883 > clnode190.clemson.cloudlab.us.50700: Flags [.], seq 1:1461, ack 294, win 2051, length 1460
09:08:09.830489 IP clnode190.clemson.cloudlab.us.50700 > 104.46.115.237.8883: Flags [.], ack 1461, win 501, length 0
09:08:09.830510 IP 104.46.115.237.8883 > clnode190.clemson.cloudlab.us.50700: Flags [P.], seq 1461:3849, ack 294, win 2051, length 2388
09:08:09.830521 IP clnode190.clemson.cloudlab.us.50700 > 104.46.115.237.8883: Flags [.], ack 3849, win 487, length 0
09:08:09.832319 IP clnode190.clemson.cloudlab.us.50700 > 104.46.115.237.8883: Flags [P.], seq 294:472, ack 3849, win 501, length 178
09:08:09.853332 IP 104.46.115.237.8883 > clnode190.clemson.cloudlab.us.50700: Flags [P.], seq 3849:3940, ack 472, win 2051, length 91
09:08:09.854554 IP clnode190.clemson.cloudlab.us.50700 > 104.46.115.237.8883: Flags [P.], seq 472:829, ack 3940, win 501, length 357
09:08:09.916991 IP 104.46.115.237.8883 > clnode190.clemson.cloudlab.us.50700: Flags [.], ack 829, win 2049, length 0
09:08:09.923871 IP 104.46.115.237.8883 > clnode190.clemson.cloudlab.us.50700: Flags [P.], seq 3940:4009, ack 829, win 2049, length 69
09:08:09.926717 IP clnode190.clemson.cloudlab.us.50700 > 104.46.115.237.8883: Flags [P.], seq 829:1458, ack 4009, win 501, length 629
09:08:09.987131 IP 104.46.115.237.8883 > clnode190.clemson.cloudlab.us.50700: Flags [.], ack 1458, win 2047, length 0
09:08:09.987145 IP clnode190.clemson.cloudlab.us.50700 > 104.46.115.237.8883: Flags [P.], seq 1458:2716, ack 4009, win 501, length 1258
09:08:10.047190 IP 104.46.115.237.8883 > clnode190.clemson.cloudlab.us.50700: Flags [.], ack 2716, win 2053, length 0
09:08:10.047203 IP clnode190.clemson.cloudlab.us.50700 > 104.46.115.237.8883: Flags [P.], seq 2716:3345, ack 4009, win 501, length 629
09:08:10.107209 IP 104.46.115.237.8883 > clnode190.clemson.cloudlab.us.50700: Flags [.], ack 3345, win 2050, length 0
09:08:10.110742 IP clnode190.clemson.cloudlab.us.50700 > 104.46.115.237.8883: Flags [P.], seq 3345:3974, ack 4009, win 501, length 629
09:08:10.172204 IP 104.46.115.237.8883 > clnode190.clemson.cloudlab.us.50700: Flags [.], ack 3974, win 2048, length 0
09:08:10.190291 IP 104.46.115.237.8883 > clnode190.clemson.cloudlab.us.50700: Flags [P.], seq 4009:4078, ack 3974, win 2048, length 69
09:08:10.198053 IP 104.46.115.237.8883 > clnode190.clemson.cloudlab.us.50700: Flags [P.], seq 4078:4147, ack 3974, win 2048, length 69
09:08:10.198594 IP clnode190.clemson.cloudlab.us.50700 > 104.46.115.237.8883: Flags [.], ack 4147, win 501, length 0
09:08:10.209347 IP 104.46.115.237.8883 > clnode190.clemson.cloudlab.us.50700: Flags [P.], seq 4147:4216, ack 3974, win 2048, length 69
09:08:10.210961 IP clnode190.clemson.cloudlab.us.50700 > 104.46.115.237.8883: Flags [P.], seq 3974:4603, ack 4216, win 501, length 629
09:08:10.216248 IP 104.46.115.237.8883 > clnode190.clemson.cloudlab.us.50700: Flags [P.], seq 4216:4285, ack 3974, win 2048, length 69
09:08:10.231184 IP 104.46.115.237.8883 > clnode190.clemson.cloudlab.us.50700: Flags [.], ack 4603, win 2053, length 0
09:08:10.236066 IP 104.46.115.237.8883 > clnode190.clemson.cloudlab.us.50700: Flags [P.], seq 4285:4354, ack 4603, win 2053, length 69
09:08:10.236479 IP clnode190.clemson.cloudlab.us.50700 > 104.46.115.237.8883: Flags [.], ack 4354, win 501, length 0
09:08:10.242747 IP 104.46.115.237.8883 > clnode190.clemson.cloudlab.us.50700: Flags [P.], seq 4354:4423, ack 4603, win 2053, length 69
09:08:10.284902 IP clnode190.clemson.cloudlab.us.50700 > 104.46.115.237.8883: Flags [.], ack 4423, win 501, length 0
09:08:10.310920 IP clnode190.clemson.cloudlab.us.50700 > 104.46.115.237.8883: Flags [P.], seq 4603:5232, ack 4423, win 501, length 629
09:08:10.338380 IP 104.46.115.237.8883 > clnode190.clemson.cloudlab.us.50700: Flags [P.], seq 4423:4492, ack 5232, win 2050, length 69
09:08:10.338407 IP clnode190.clemson.cloudlab.us.50700 > 104.46.115.237.8883: Flags [.], ack 4492, win 501, length 0
09:08:10.410916 IP clnode190.clemson.cloudlab.us.50700 > 104.46.115.237.8883: Flags [P.], seq 5232:5861, ack 4492, win 501, length 629
09:08:10.439213 IP 104.46.115.237.8883 > clnode190.clemson.cloudlab.us.50700: Flags [P.], seq 4492:4561, ack 5861, win 2048, length 69
09:08:10.439240 IP clnode190.clemson.cloudlab.us.50700 > 104.46.115.237.8883: Flags [.], ack 4561, win 501, length 0
09:08:10.511931 IP clnode190.clemson.cloudlab.us.50700 > 104.46.115.237.8883: Flags [P.], seq 5861:6490, ack 4561, win 501, length 629
09:08:10.549447 IP 104.46.115.237.8883 > clnode190.clemson.cloudlab.us.50700: Flags [P.], seq 4561:4630, ack 6490, win 2053, length 69
09:08:10.549474 IP clnode190.clemson.cloudlab.us.50700 > 104.46.115.237.8883: Flags [.], ack 4630, win 501, length 0
09:08:10.611526 IP clnode190.clemson.cloudlab.us.50700 > 104.46.115.237.8883: Flags [P.], seq 6490:7119, ack 4630, win 501, length 629
09:08:10.639037 IP 104.46.115.237.8883 > clnode190.clemson.cloudlab.us.50700: Flags [P.], seq 4630:4699, ack 7119, win 2050, length 69
09:08:10.639064 IP clnode190.clemson.cloudlab.us.50700 > 104.46.115.237.8883: Flags [.], ack 4699, win 501, length 0
09:08:10.712550 IP clnode190.clemson.cloudlab.us.50700 > 104.46.115.237.8883: Flags [P.], seq 7119:7748, ack 4699, win 501, length 629
09:08:10.743151 IP 104.46.115.237.8883 > clnode190.clemson.cloudlab.us.50700: Flags [P.], seq 4699:4768, ack 7748, win 2048, length 69
09:08:10.743178 IP clnode190.clemson.cloudlab.us.50700 > 104.46.115.237.8883: Flags [.], ack 4768, win 501, length 0
09:08:10.812412 IP clnode190.clemson.cloudlab.us.50700 > 104.46.115.237.8883: Flags [P.], seq 7748:8377, ack 4768, win 501, length 629
09:08:10.840908 IP 104.46.115.237.8883 > clnode190.clemson.cloudlab.us.50700: Flags [P.], seq 4768:4837, ack 8377, win 2053, length 69
09:08:10.840918 IP clnode190.clemson.cloudlab.us.50700 > 104.46.115.237.8883: Flags [.], ack 4837, win 501, length 0
09:08:10.912301 IP clnode190.clemson.cloudlab.us.50700 > 104.46.115.237.8883: Flags [P.], seq 8377:9006, ack 4837, win 501, length 629
09:08:10.950578 IP 104.46.115.237.8883 > clnode190.clemson.cloudlab.us.50700: Flags [P.], seq 4837:4906, ack 9006, win 2050, length 69
09:08:10.951184 IP clnode190.clemson.cloudlab.us.50700 > 104.46.115.237.8883: Flags [.], ack 4906, win 501, length 0
09:08:11.013254 IP clnode190.clemson.cloudlab.us.50700 > 104.46.115.237.8883: Flags [P.], seq 9006:9635, ack 4906, win 501, length 629
09:08:11.043654 IP 104.46.115.237.8883 > clnode190.clemson.cloudlab.us.50700: Flags [P.], seq 4906:4975, ack 9635, win 2048, length 69
09:08:11.044369 IP clnode190.clemson.cloudlab.us.50700 > 104.46.115.237.8883: Flags [.], ack 4975, win 501, length 0
09:08:11.113249 IP clnode190.clemson.cloudlab.us.50700 > 104.46.115.237.8883: Flags [P.], seq 9635:10264, ack 4975, win 501, length 629
09:08:11.141160 IP 104.46.115.237.8883 > clnode190.clemson.cloudlab.us.50700: Flags [P.], seq 4975:5044, ack 10264, win 2053, length 69
09:08:11.142162 IP clnode190.clemson.cloudlab.us.50700 > 104.46.115.237.8883: Flags [.], ack 5044, win 501, length 0
09:08:11.213254 IP clnode190.clemson.cloudlab.us.50700 > 104.46.115.237.8883: Flags [P.], seq 10264:10893, ack 5044, win 501, length 629
09:08:11.242313 IP 104.46.115.237.8883 > clnode190.clemson.cloudlab.us.50700: Flags [P.], seq 5044:5113, ack 10893, win 2050, length 69
09:08:11.243277 IP clnode190.clemson.cloudlab.us.50700 > 104.46.115.237.8883: Flags [.], ack 5113, win 501, length 0
09:08:11.313264 IP clnode190.clemson.cloudlab.us.50700 > 104.46.115.237.8883: Flags [P.], seq 10893:11522, ack 5113, win 501, length 629
09:08:11.356390 IP 104.46.115.237.8883 > clnode190.clemson.cloudlab.us.50700: Flags [P.], seq 5113:5182, ack 11522, win 2048, length 69
09:08:11.356588 IP clnode190.clemson.cloudlab.us.50700 > 104.46.115.237.8883: Flags [.], ack 5182, win 501, length 0
09:08:11.414338 IP clnode190.clemson.cloudlab.us.50700 > 104.46.115.237.8883: Flags [P.], seq 11522:12151, ack 5182, win 501, length 629
09:08:11.446180 IP 104.46.115.237.8883 > clnode190.clemson.cloudlab.us.50700: Flags [P.], seq 5182:5251, ack 12151, win 2053, length 69
09:08:11.446498 IP clnode190.clemson.cloudlab.us.50700 > 104.46.115.237.8883: Flags [.], ack 5251, win 501, length 0
09:08:11.514031 IP clnode190.clemson.cloudlab.us.50700 > 104.46.115.237.8883: Flags [P.], seq 12151:12780, ack 5251, win 501, length 629
09:08:11.544577 IP 104.46.115.237.8883 > clnode190.clemson.cloudlab.us.50700: Flags [P.], seq 5251:5320, ack 12780, win 2050, length 69
09:08:11.545086 IP clnode190.clemson.cloudlab.us.50700 > 104.46.115.237.8883: Flags [.], ack 5320, win 501, length 0
09:08:11.614924 IP clnode190.clemson.cloudlab.us.50700 > 104.46.115.237.8883: Flags [P.], seq 12780:13409, ack 5320, win 501, length 629
09:08:11.647005 IP 104.46.115.237.8883 > clnode190.clemson.cloudlab.us.50700: Flags [P.], seq 5320:5389, ack 13409, win 2048, length 69
09:08:11.647103 IP clnode190.clemson.cloudlab.us.50700 > 104.46.115.237.8883: Flags [.], ack 5389, win 501, length 0
09:08:11.714687 IP clnode190.clemson.cloudlab.us.50700 > 104.46.115.237.8883: Flags [P.], seq 13409:14038, ack 5389, win 501, length 629
09:08:11.751803 IP 104.46.115.237.8883 > clnode190.clemson.cloudlab.us.50700: Flags [P.], seq 5389:5458, ack 14038, win 2053, length 69
09:08:11.752368 IP clnode190.clemson.cloudlab.us.50700 > 104.46.115.237.8883: Flags [.], ack 5458, win 501, length 0
09:08:11.815527 IP clnode190.clemson.cloudlab.us.50700 > 104.46.115.237.8883: Flags [P.], seq 14038:14667, ack 5458, win 501, length 629
09:08:11.846909 IP 104.46.115.237.8883 > clnode190.clemson.cloudlab.us.50700: Flags [P.], seq 5458:5527, ack 14667, win 2050, length 69
09:08:11.847667 IP clnode190.clemson.cloudlab.us.50700 > 104.46.115.237.8883: Flags [.], ack 5527, win 501, length 0
09:08:11.915334 IP clnode190.clemson.cloudlab.us.50700 > 104.46.115.237.8883: Flags [P.], seq 14667:15296, ack 5527, win 501, length 629
09:08:11.945705 IP 104.46.115.237.8883 > clnode190.clemson.cloudlab.us.50700: Flags [P.], seq 5527:5596, ack 15296, win 2048, length 69
09:08:11.946416 IP clnode190.clemson.cloudlab.us.50700 > 104.46.115.237.8883: Flags [.], ack 5596, win 501, length 0
09:08:12.015203 IP clnode190.clemson.cloudlab.us.50700 > 104.46.115.237.8883: Flags [P.], seq 15296:15925, ack 5596, win 501, length 629
09:08:12.046297 IP 104.46.115.237.8883 > clnode190.clemson.cloudlab.us.50700: Flags [P.], seq 5596:5665, ack 15925, win 2053, length 69
09:08:12.047408 IP clnode190.clemson.cloudlab.us.50700 > 104.46.115.237.8883: Flags [.], ack 5665, win 501, length 0
09:08:12.116271 IP clnode190.clemson.cloudlab.us.50700 > 104.46.115.237.8883: Flags [P.], seq 15925:16554, ack 5665, win 501, length 629
09:08:12.153974 IP 104.46.115.237.8883 > clnode190.clemson.cloudlab.us.50700: Flags [P.], seq 5665:5734, ack 16554, win 2050, length 69
09:08:12.153988 IP clnode190.clemson.cloudlab.us.50700 > 104.46.115.237.8883: Flags [.], ack 5734, win 501, length 0
09:08:12.216015 IP clnode190.clemson.cloudlab.us.50700 > 104.46.115.237.8883: Flags [P.], seq 16554:17183, ack 5734, win 501, length 629
09:08:12.247240 IP 104.46.115.237.8883 > clnode190.clemson.cloudlab.us.50700: Flags [P.], seq 5734:5803, ack 17183, win 2048, length 69
09:08:12.248214 IP clnode190.clemson.cloudlab.us.50700 > 104.46.115.237.8883: Flags [.], ack 5803, win 501, length 0
09:08:12.315911 IP clnode190.clemson.cloudlab.us.50700 > 104.46.115.237.8883: Flags [P.], seq 17183:17812, ack 5803, win 501, length 629
09:08:12.343391 IP 104.46.115.237.8883 > clnode190.clemson.cloudlab.us.50700: Flags [P.], seq 5803:5872, ack 17812, win 2053, length 69
09:08:12.343648 IP clnode190.clemson.cloudlab.us.50700 > 104.46.115.237.8883: Flags [.], ack 5872, win 501, length 0
09:08:12.416918 IP clnode190.clemson.cloudlab.us.50700 > 104.46.115.237.8883: Flags [P.], seq 17812:18441, ack 5872, win 501, length 629
09:08:12.444624 IP 104.46.115.237.8883 > clnode190.clemson.cloudlab.us.50700: Flags [P.], seq 5872:5941, ack 18441, win 2050, length 69
09:08:12.444706 IP clnode190.clemson.cloudlab.us.50700 > 104.46.115.237.8883: Flags [.], ack 5941, win 501, length 0
09:08:12.516682 IP clnode190.clemson.cloudlab.us.50700 > 104.46.115.237.8883: Flags [P.], seq 18441:19070, ack 5941, win 501, length 629
09:08:12.552260 IP 104.46.115.237.8883 > clnode190.clemson.cloudlab.us.50700: Flags [P.], seq 5941:6010, ack 19070, win 2048, length 69
09:08:12.553271 IP clnode190.clemson.cloudlab.us.50700 > 104.46.115.237.8883: Flags [.], ack 6010, win 501, length 0
09:08:12.617339 IP clnode190.clemson.cloudlab.us.50700 > 104.46.115.237.8883: Flags [P.], seq 19070:19699, ack 6010, win 501, length 629
09:08:12.645489 IP 104.46.115.237.8883 > clnode190.clemson.cloudlab.us.50700: Flags [P.], seq 6010:6079, ack 19699, win 2053, length 69
09:08:12.646201 IP clnode190.clemson.cloudlab.us.50700 > 104.46.115.237.8883: Flags [.], ack 6079, win 501, length 0
09:08:12.717230 IP clnode190.clemson.cloudlab.us.50700 > 104.46.115.237.8883: Flags [P.], seq 19699:20328, ack 6079, win 501, length 629
09:08:12.745042 IP 104.46.115.237.8883 > clnode190.clemson.cloudlab.us.50700: Flags [P.], seq 6079:6148, ack 20328, win 2050, length 69
09:08:12.746094 IP clnode190.clemson.cloudlab.us.50700 > 104.46.115.237.8883: Flags [.], ack 6148, win 501, length 0
09:08:12.818150 IP clnode190.clemson.cloudlab.us.50700 > 104.46.115.237.8883: Flags [P.], seq 20328:20957, ack 6148, win 501, length 629
09:08:12.845265 IP 104.46.115.237.8883 > clnode190.clemson.cloudlab.us.50700: Flags [P.], seq 6148:6217, ack 20957, win 2048, length 69
09:08:12.845931 IP clnode190.clemson.cloudlab.us.50700 > 104.46.115.237.8883: Flags [.], ack 6217, win 501, length 0
09:08:12.918186 IP clnode190.clemson.cloudlab.us.50700 > 104.46.115.237.8883: Flags [P.], seq 20957:21586, ack 6217, win 501, length 629
09:08:12.954824 IP 104.46.115.237.8883 > clnode190.clemson.cloudlab.us.50700: Flags [P.], seq 6217:6286, ack 21586, win 2053, length 69
09:08:12.955870 IP clnode190.clemson.cloudlab.us.50700 > 104.46.115.237.8883: Flags [.], ack 6286, win 501, length 0
09:08:13.017795 IP clnode190.clemson.cloudlab.us.50700 > 104.46.115.237.8883: Flags [P.], seq 21586:22215, ack 6286, win 501, length 629
09:08:13.045460 IP 104.46.115.237.8883 > clnode190.clemson.cloudlab.us.50700: Flags [P.], seq 6286:6355, ack 22215, win 2050, length 69
09:08:13.046584 IP clnode190.clemson.cloudlab.us.50700 > 104.46.115.237.8883: Flags [.], ack 6355, win 501, length 0
09:08:13.118464 IP clnode190.clemson.cloudlab.us.50700 > 104.46.115.237.8883: Flags [P.], seq 22215:22844, ack 6355, win 501, length 629
09:08:13.148332 IP 104.46.115.237.8883 > clnode190.clemson.cloudlab.us.50700: Flags [P.], seq 6355:6424, ack 22844, win 2048, length 69
09:08:13.148487 IP clnode190.clemson.cloudlab.us.50700 > 104.46.115.237.8883: Flags [.], ack 6424, win 501, length 0
09:08:13.218505 IP clnode190.clemson.cloudlab.us.50700 > 104.46.115.237.8883: Flags [P.], seq 22844:23473, ack 6424, win 501, length 629
09:08:13.246166 IP 104.46.115.237.8883 > clnode190.clemson.cloudlab.us.50700: Flags [P.], seq 6424:6493, ack 23473, win 2053, length 69
09:08:13.246249 IP clnode190.clemson.cloudlab.us.50700 > 104.46.115.237.8883: Flags [.], ack 6493, win 501, length 0
09:08:13.318423 IP clnode190.clemson.cloudlab.us.50700 > 104.46.115.237.8883: Flags [P.], seq 23473:24102, ack 6493, win 501, length 629
09:08:13.355960 IP 104.46.115.237.8883 > clnode190.clemson.cloudlab.us.50700: Flags [P.], seq 6493:6562, ack 24102, win 2050, length 69
09:08:13.356218 IP clnode190.clemson.cloudlab.us.50700 > 104.46.115.237.8883: Flags [.], ack 6562, win 501, length 0
09:08:13.419498 IP clnode190.clemson.cloudlab.us.50700 > 104.46.115.237.8883: Flags [P.], seq 24102:24731, ack 6562, win 501, length 629
09:08:13.447888 IP 104.46.115.237.8883 > clnode190.clemson.cloudlab.us.50700: Flags [P.], seq 6562:6631, ack 24731, win 2048, length 69
09:08:13.448351 IP clnode190.clemson.cloudlab.us.50700 > 104.46.115.237.8883: Flags [.], ack 6631, win 501, length 0
09:08:13.519330 IP clnode190.clemson.cloudlab.us.50700 > 104.46.115.237.8883: Flags [P.], seq 24731:25360, ack 6631, win 501, length 629
09:08:13.548066 IP 104.46.115.237.8883 > clnode190.clemson.cloudlab.us.50700: Flags [P.], seq 6631:6700, ack 25360, win 2053, length 69
09:08:13.548124 IP clnode190.clemson.cloudlab.us.50700 > 104.46.115.237.8883: Flags [.], ack 6700, win 501, length 0
09:08:13.619078 IP clnode190.clemson.cloudlab.us.50700 > 104.46.115.237.8883: Flags [P.], seq 25360:25989, ack 6700, win 501, length 629
09:08:13.647295 IP 104.46.115.237.8883 > clnode190.clemson.cloudlab.us.50700: Flags [P.], seq 6700:6769, ack 25989, win 2050, length 69
09:08:13.647935 IP clnode190.clemson.cloudlab.us.50700 > 104.46.115.237.8883: Flags [.], ack 6769, win 501, length 0
09:08:13.718981 IP clnode190.clemson.cloudlab.us.50700 > 104.46.115.237.8883: Flags [P.], seq 25989:26618, ack 6769, win 501, length 629
09:08:13.767094 IP 104.46.115.237.8883 > clnode190.clemson.cloudlab.us.50700: Flags [P.], seq 6769:6838, ack 26618, win 2048, length 69
09:08:13.767729 IP clnode190.clemson.cloudlab.us.50700 > 104.46.115.237.8883: Flags [.], ack 6838, win 501, length 0
09:08:13.819853 IP clnode190.clemson.cloudlab.us.50700 > 104.46.115.237.8883: Flags [P.], seq 26618:27247, ack 6838, win 501, length 629
09:08:13.883613 IP 104.46.115.237.8883 > clnode190.clemson.cloudlab.us.50700: Flags [P.], seq 6838:6907, ack 27247, win 2053, length 69
09:08:13.884246 IP clnode190.clemson.cloudlab.us.50700 > 104.46.115.237.8883: Flags [.], ack 6907, win 501, length 0
09:08:13.919857 IP clnode190.clemson.cloudlab.us.50700 > 104.46.115.237.8883: Flags [P.], seq 27247:27876, ack 6907, win 501, length 629
09:08:13.948673 IP 104.46.115.237.8883 > clnode190.clemson.cloudlab.us.50700: Flags [P.], seq 6907:6976, ack 27876, win 2050, length 69
09:08:13.988835 IP clnode190.clemson.cloudlab.us.50700 > 104.46.115.237.8883: Flags [.], ack 6976, win 501, length 0
09:08:14.019838 IP clnode190.clemson.cloudlab.us.50700 > 104.46.115.237.8883: Flags [P.], seq 27876:28505, ack 6976, win 501, length 629
09:08:14.049271 IP 104.46.115.237.8883 > clnode190.clemson.cloudlab.us.50700: Flags [P.], seq 6976:7045, ack 28505, win 2048, length 69
09:08:14.049877 IP clnode190.clemson.cloudlab.us.50700 > 104.46.115.237.8883: Flags [.], ack 7045, win 501, length 0
09:08:14.119822 IP clnode190.clemson.cloudlab.us.50700 > 104.46.115.237.8883: Flags [P.], seq 28505:29134, ack 7045, win 501, length 629
09:08:14.160982 IP 104.46.115.237.8883 > clnode190.clemson.cloudlab.us.50700: Flags [P.], seq 7045:7114, ack 29134, win 2053, length 69
09:08:14.161969 IP clnode190.clemson.cloudlab.us.50700 > 104.46.115.237.8883: Flags [.], ack 7114, win 501, length 0
09:08:14.220726 IP clnode190.clemson.cloudlab.us.50700 > 104.46.115.237.8883: Flags [P.], seq 29134:29763, ack 7114, win 501, length 629
09:08:14.247964 IP 104.46.115.237.8883 > clnode190.clemson.cloudlab.us.50700: Flags [P.], seq 7114:7183, ack 29763, win 2050, length 69
09:08:14.248459 IP clnode190.clemson.cloudlab.us.50700 > 104.46.115.237.8883: Flags [.], ack 7183, win 501, length 0
09:08:14.320606 IP clnode190.clemson.cloudlab.us.50700 > 104.46.115.237.8883: Flags [P.], seq 29763:30392, ack 7183, win 501, length 629
09:08:14.349284 IP 104.46.115.237.8883 > clnode190.clemson.cloudlab.us.50700: Flags [P.], seq 7183:7252, ack 30392, win 2048, length 69
09:08:14.349522 IP clnode190.clemson.cloudlab.us.50700 > 104.46.115.237.8883: Flags [.], ack 7252, win 501, length 0
09:08:14.420627 IP clnode190.clemson.cloudlab.us.50700 > 104.46.115.237.8883: Flags [P.], seq 30392:31021, ack 7252, win 501, length 629
09:08:14.449400 IP 104.46.115.237.8883 > clnode190.clemson.cloudlab.us.50700: Flags [P.], seq 7252:7321, ack 31021, win 2053, length 69
09:08:14.449463 IP clnode190.clemson.cloudlab.us.50700 > 104.46.115.237.8883: Flags [.], ack 7321, win 501, length 0
09:08:14.521504 IP clnode190.clemson.cloudlab.us.50700 > 104.46.115.237.8883: Flags [P.], seq 31021:31650, ack 7321, win 501, length 629
09:08:14.560834 IP 104.46.115.237.8883 > clnode190.clemson.cloudlab.us.50700: Flags [P.], seq 7321:7390, ack 31650, win 2050, length 69
09:08:14.561411 IP clnode190.clemson.cloudlab.us.50700 > 104.46.115.237.8883: Flags [.], ack 7390, win 501, length 0
09:08:14.621520 IP clnode190.clemson.cloudlab.us.50700 > 104.46.115.237.8883: Flags [P.], seq 31650:32279, ack 7390, win 501, length 629
09:08:14.651354 IP 104.46.115.237.8883 > clnode190.clemson.cloudlab.us.50700: Flags [P.], seq 7390:7459, ack 32279, win 2048, length 69
09:08:14.651490 IP clnode190.clemson.cloudlab.us.50700 > 104.46.115.237.8883: Flags [.], ack 7459, win 501, length 0
09:08:14.721394 IP clnode190.clemson.cloudlab.us.50700 > 104.46.115.237.8883: Flags [P.], seq 32279:32908, ack 7459, win 501, length 629
09:08:14.750334 IP 104.46.115.237.8883 > clnode190.clemson.cloudlab.us.50700: Flags [P.], seq 7459:7528, ack 32908, win 2053, length 69
09:08:14.751358 IP clnode190.clemson.cloudlab.us.50700 > 104.46.115.237.8883: Flags [.], ack 7528, win 501, length 0
09:08:14.822381 IP clnode190.clemson.cloudlab.us.50700 > 104.46.115.237.8883: Flags [P.], seq 32908:33537, ack 7528, win 501, length 629
09:08:14.854247 IP 104.46.115.237.8883 > clnode190.clemson.cloudlab.us.50700: Flags [P.], seq 7528:7597, ack 33537, win 2050, length 69
09:08:14.854600 IP clnode190.clemson.cloudlab.us.50700 > 104.46.115.237.8883: Flags [.], ack 7597, win 501, length 0
09:08:14.922354 IP clnode190.clemson.cloudlab.us.50700 > 104.46.115.237.8883: Flags [P.], seq 33537:34166, ack 7597, win 501, length 629
09:08:14.958641 IP 104.46.115.237.8883 > clnode190.clemson.cloudlab.us.50700: Flags [P.], seq 7597:7666, ack 34166, win 2048, length 69
09:08:14.958854 IP clnode190.clemson.cloudlab.us.50700 > 104.46.115.237.8883: Flags [.], ack 7666, win 501, length 0
09:08:15.023131 IP clnode190.clemson.cloudlab.us.50700 > 104.46.115.237.8883: Flags [P.], seq 34166:34795, ack 7666, win 501, length 629
09:08:15.050391 IP 104.46.115.237.8883 > clnode190.clemson.cloudlab.us.50700: Flags [P.], seq 7666:7735, ack 34795, win 2053, length 69
09:08:15.050874 IP clnode190.clemson.cloudlab.us.50700 > 104.46.115.237.8883: Flags [.], ack 7735, win 501, length 0
09:08:15.122983 IP clnode190.clemson.cloudlab.us.50700 > 104.46.115.237.8883: Flags [P.], seq 34795:35424, ack 7735, win 501, length 629
09:08:15.151192 IP 104.46.115.237.8883 > clnode190.clemson.cloudlab.us.50700: Flags [P.], seq 7735:7804, ack 35424, win 2050, length 69
09:08:15.151903 IP clnode190.clemson.cloudlab.us.50700 > 104.46.115.237.8883: Flags [.], ack 7804, win 501, length 0
09:08:15.222902 IP clnode190.clemson.cloudlab.us.50700 > 104.46.115.237.8883: Flags [P.], seq 35424:36053, ack 7804, win 501, length 629
09:08:15.251144 IP 104.46.115.237.8883 > clnode190.clemson.cloudlab.us.50700: Flags [P.], seq 7804:7873, ack 36053, win 2048, length 69
09:08:15.251771 IP clnode190.clemson.cloudlab.us.50700 > 104.46.115.237.8883: Flags [.], ack 7873, win 501, length 0
09:08:15.323953 IP clnode190.clemson.cloudlab.us.50700 > 104.46.115.237.8883: Flags [P.], seq 36053:36682, ack 7873, win 501, length 629
09:08:15.369655 IP 104.46.115.237.8883 > clnode190.clemson.cloudlab.us.50700: Flags [P.], seq 7873:7942, ack 36682, win 2053, length 69
09:08:15.370594 IP clnode190.clemson.cloudlab.us.50700 > 104.46.115.237.8883: Flags [.], ack 7942, win 501, length 0
09:08:15.423909 IP clnode190.clemson.cloudlab.us.50700 > 104.46.115.237.8883: Flags [P.], seq 36682:37311, ack 7942, win 501, length 629
09:08:15.451841 IP 104.46.115.237.8883 > clnode190.clemson.cloudlab.us.50700: Flags [P.], seq 7942:8011, ack 37311, win 2050, length 69
09:08:15.452736 IP clnode190.clemson.cloudlab.us.50700 > 104.46.115.237.8883: Flags [.], ack 8011, win 501, length 0
09:08:15.523730 IP clnode190.clemson.cloudlab.us.50700 > 104.46.115.237.8883: Flags [P.], seq 37311:37940, ack 8011, win 501, length 629
09:08:15.552155 IP 104.46.115.237.8883 > clnode190.clemson.cloudlab.us.50700: Flags [P.], seq 8011:8080, ack 37940, win 2048, length 69
09:08:15.552474 IP clnode190.clemson.cloudlab.us.50700 > 104.46.115.237.8883: Flags [.], ack 8080, win 501, length 0
09:08:15.624722 IP clnode190.clemson.cloudlab.us.50700 > 104.46.115.237.8883: Flags [P.], seq 37940:38569, ack 8080, win 501, length 629
09:08:15.652671 IP 104.46.115.237.8883 > clnode190.clemson.cloudlab.us.50700: Flags [P.], seq 8080:8149, ack 38569, win 2053, length 69
09:08:15.653615 IP clnode190.clemson.cloudlab.us.50700 > 104.46.115.237.8883: Flags [.], ack 8149, win 501, length 0
09:08:15.724711 IP clnode190.clemson.cloudlab.us.50700 > 104.46.115.237.8883: Flags [P.], seq 38569:39198, ack 8149, win 501, length 629
09:08:15.763103 IP 104.46.115.237.8883 > clnode190.clemson.cloudlab.us.50700: Flags [P.], seq 8149:8218, ack 39198, win 2050, length 69
09:08:15.763559 IP clnode190.clemson.cloudlab.us.50700 > 104.46.115.237.8883: Flags [.], ack 8218, win 501, length 0
09:08:15.824602 IP clnode190.clemson.cloudlab.us.50700 > 104.46.115.237.8883: Flags [P.], seq 39198:39827, ack 8218, win 501, length 629
09:08:15.853136 IP 104.46.115.237.8883 > clnode190.clemson.cloudlab.us.50700: Flags [P.], seq 8218:8287, ack 39827, win 2048, length 69
09:08:15.853463 IP clnode190.clemson.cloudlab.us.50700 > 104.46.115.237.8883: Flags [.], ack 8287, win 501, length 0
09:08:15.925509 IP clnode190.clemson.cloudlab.us.50700 > 104.46.115.237.8883: Flags [P.], seq 39827:40456, ack 8287, win 501, length 629
09:08:15.955127 IP 104.46.115.237.8883 > clnode190.clemson.cloudlab.us.50700: Flags [P.], seq 8287:8356, ack 40456, win 2053, length 69
09:08:15.955528 IP clnode190.clemson.cloudlab.us.50700 > 104.46.115.237.8883: Flags [.], ack 8356, win 501, length 0
09:08:16.025513 IP clnode190.clemson.cloudlab.us.50700 > 104.46.115.237.8883: Flags [P.], seq 40456:41085, ack 8356, win 501, length 629
09:08:16.053681 IP 104.46.115.237.8883 > clnode190.clemson.cloudlab.us.50700: Flags [P.], seq 8356:8425, ack 41085, win 2050, length 69
09:08:16.054383 IP clnode190.clemson.cloudlab.us.50700 > 104.46.115.237.8883: Flags [.], ack 8425, win 501, length 0
09:08:16.125402 IP clnode190.clemson.cloudlab.us.50700 > 104.46.115.237.8883: Flags [P.], seq 41085:41714, ack 8425, win 501, length 629
09:08:16.161954 IP 104.46.115.237.8883 > clnode190.clemson.cloudlab.us.50700: Flags [P.], seq 8425:8494, ack 41714, win 2048, length 69
09:08:16.162060 IP clnode190.clemson.cloudlab.us.50700 > 104.46.115.237.8883: Flags [.], ack 8494, win 501, length 0
09:08:16.226582 IP clnode190.clemson.cloudlab.us.50700 > 104.46.115.237.8883: Flags [P.], seq 41714:42343, ack 8494, win 501, length 629
09:08:16.254307 IP 104.46.115.237.8883 > clnode190.clemson.cloudlab.us.50700: Flags [P.], seq 8494:8563, ack 42343, win 2053, length 69
09:08:16.254333 IP clnode190.clemson.cloudlab.us.50700 > 104.46.115.237.8883: Flags [.], ack 8563, win 501, length 0
09:08:16.326480 IP clnode190.clemson.cloudlab.us.50700 > 104.46.115.237.8883: Flags [P.], seq 42343:42972, ack 8563, win 501, length 629
09:08:16.355737 IP 104.46.115.237.8883 > clnode190.clemson.cloudlab.us.50700: Flags [P.], seq 8563:8632, ack 42972, win 2050, length 69
09:08:16.356472 IP clnode190.clemson.cloudlab.us.50700 > 104.46.115.237.8883: Flags [.], ack 8632, win 501, length 0
09:08:16.426447 IP clnode190.clemson.cloudlab.us.50700 > 104.46.115.237.8883: Flags [P.], seq 42972:43601, ack 8632, win 501, length 629
09:08:16.453808 IP 104.46.115.237.8883 > clnode190.clemson.cloudlab.us.50700: Flags [P.], seq 8632:8701, ack 43601, win 2048, length 69
09:08:16.454190 IP clnode190.clemson.cloudlab.us.50700 > 104.46.115.237.8883: Flags [.], ack 8701, win 501, length 0
09:08:16.526441 IP clnode190.clemson.cloudlab.us.50700 > 104.46.115.237.8883: Flags [P.], seq 43601:44230, ack 8701, win 501, length 629
09:08:16.566444 IP 104.46.115.237.8883 > clnode190.clemson.cloudlab.us.50700: Flags [P.], seq 8701:8770, ack 44230, win 2053, length 69
09:08:16.567493 IP clnode190.clemson.cloudlab.us.50700 > 104.46.115.237.8883: Flags [.], ack 8770, win 501, length 0
09:08:16.627381 IP clnode190.clemson.cloudlab.us.50700 > 104.46.115.237.8883: Flags [P.], seq 44230:44859, ack 8770, win 501, length 629
09:08:16.654793 IP 104.46.115.237.8883 > clnode190.clemson.cloudlab.us.50700: Flags [P.], seq 8770:8839, ack 44859, win 2050, length 69
09:08:16.655121 IP clnode190.clemson.cloudlab.us.50700 > 104.46.115.237.8883: Flags [.], ack 8839, win 501, length 0
09:08:16.727191 IP clnode190.clemson.cloudlab.us.50700 > 104.46.115.237.8883: Flags [P.], seq 44859:45488, ack 8839, win 501, length 629
09:08:16.768710 IP 104.46.115.237.8883 > clnode190.clemson.cloudlab.us.50700: Flags [P.], seq 8839:8908, ack 45488, win 2048, length 69
09:08:16.769412 IP clnode190.clemson.cloudlab.us.50700 > 104.46.115.237.8883: Flags [.], ack 8908, win 501, length 0
09:08:16.828194 IP clnode190.clemson.cloudlab.us.50700 > 104.46.115.237.8883: Flags [P.], seq 45488:46117, ack 8908, win 501, length 629
09:08:16.855858 IP 104.46.115.237.8883 > clnode190.clemson.cloudlab.us.50700: Flags [P.], seq 8908:8977, ack 46117, win 2053, length 69
09:08:16.855922 IP clnode190.clemson.cloudlab.us.50700 > 104.46.115.237.8883: Flags [.], ack 8977, win 501, length 0
09:08:16.927919 IP clnode190.clemson.cloudlab.us.50700 > 104.46.115.237.8883: Flags [P.], seq 46117:46746, ack 8977, win 501, length 629
09:08:16.965975 IP 104.46.115.237.8883 > clnode190.clemson.cloudlab.us.50700: Flags [P.], seq 8977:9046, ack 46746, win 2050, length 69
09:08:16.966667 IP clnode190.clemson.cloudlab.us.50700 > 104.46.115.237.8883: Flags [.], ack 9046, win 501, length 0
09:08:17.028677 IP clnode190.clemson.cloudlab.us.50700 > 104.46.115.237.8883: Flags [P.], seq 46746:47375, ack 9046, win 501, length 629
09:08:17.057206 IP 104.46.115.237.8883 > clnode190.clemson.cloudlab.us.50700: Flags [P.], seq 9046:9115, ack 47375, win 2048, length 69
09:08:17.057397 IP clnode190.clemson.cloudlab.us.50700 > 104.46.115.237.8883: Flags [.], ack 9115, win 501, length 0
09:08:17.128294 IP clnode190.clemson.cloudlab.us.50700 > 104.46.115.237.8883: Flags [P.], seq 47375:48004, ack 9115, win 501, length 629
09:08:17.158837 IP 104.46.115.237.8883 > clnode190.clemson.cloudlab.us.50700: Flags [P.], seq 9115:9184, ack 48004, win 2053, length 69
09:08:17.159408 IP clnode190.clemson.cloudlab.us.50700 > 104.46.115.237.8883: Flags [.], ack 9184, win 501, length 0
09:08:17.229357 IP clnode190.clemson.cloudlab.us.50700 > 104.46.115.237.8883: Flags [P.], seq 48004:48633, ack 9184, win 501, length 629
09:08:17.257110 IP 104.46.115.237.8883 > clnode190.clemson.cloudlab.us.50700: Flags [P.], seq 9184:9253, ack 48633, win 2050, length 69
09:08:17.257154 IP clnode190.clemson.cloudlab.us.50700 > 104.46.115.237.8883: Flags [.], ack 9253, win 501, length 0
09:08:17.329290 IP clnode190.clemson.cloudlab.us.50700 > 104.46.115.237.8883: Flags [P.], seq 48633:49262, ack 9253, win 501, length 629
09:08:17.373069 IP 104.46.115.237.8883 > clnode190.clemson.cloudlab.us.50700: Flags [P.], seq 9253:9322, ack 49262, win 2048, length 69
09:08:17.373675 IP clnode190.clemson.cloudlab.us.50700 > 104.46.115.237.8883: Flags [.], ack 9322, win 501, length 0
09:08:17.429228 IP clnode190.clemson.cloudlab.us.50700 > 104.46.115.237.8883: Flags [P.], seq 49262:49891, ack 9322, win 501, length 629
09:08:17.458775 IP 104.46.115.237.8883 > clnode190.clemson.cloudlab.us.50700: Flags [P.], seq 9322:9391, ack 49891, win 2053, length 69
09:08:17.459224 IP clnode190.clemson.cloudlab.us.50700 > 104.46.115.237.8883: Flags [.], ack 9391, win 501, length 0
09:08:17.529184 IP clnode190.clemson.cloudlab.us.50700 > 104.46.115.237.8883: Flags [P.], seq 49891:50520, ack 9391, win 501, length 629
09:08:17.571451 IP 104.46.115.237.8883 > clnode190.clemson.cloudlab.us.50700: Flags [P.], seq 9391:9460, ack 50520, win 2050, length 69
09:08:17.572424 IP clnode190.clemson.cloudlab.us.50700 > 104.46.115.237.8883: Flags [.], ack 9460, win 501, length 0
09:08:17.630185 IP clnode190.clemson.cloudlab.us.50700 > 104.46.115.237.8883: Flags [P.], seq 50520:51149, ack 9460, win 501, length 629
09:08:17.657959 IP 104.46.115.237.8883 > clnode190.clemson.cloudlab.us.50700: Flags [P.], seq 9460:9529, ack 51149, win 2048, length 69
09:08:17.658971 IP clnode190.clemson.cloudlab.us.50700 > 104.46.115.237.8883: Flags [.], ack 9529, win 501, length 0
09:08:17.729982 IP clnode190.clemson.cloudlab.us.50700 > 104.46.115.237.8883: Flags [P.], seq 51149:51778, ack 9529, win 501, length 629
09:08:17.766915 IP 104.46.115.237.8883 > clnode190.clemson.cloudlab.us.50700: Flags [P.], seq 9529:9598, ack 51778, win 2053, length 69
09:08:17.767672 IP clnode190.clemson.cloudlab.us.50700 > 104.46.115.237.8883: Flags [.], ack 9598, win 501, length 0
09:08:17.830982 IP clnode190.clemson.cloudlab.us.50700 > 104.46.115.237.8883: Flags [P.], seq 51778:52407, ack 9598, win 501, length 629
09:08:17.860025 IP 104.46.115.237.8883 > clnode190.clemson.cloudlab.us.50700: Flags [P.], seq 9598:9667, ack 52407, win 2050, length 69
09:08:17.860902 IP clnode190.clemson.cloudlab.us.50700 > 104.46.115.237.8883: Flags [.], ack 9667, win 501, length 0
09:08:17.930724 IP clnode190.clemson.cloudlab.us.50700 > 104.46.115.237.8883: Flags [P.], seq 52407:53036, ack 9667, win 501, length 629
09:08:17.959222 IP 104.46.115.237.8883 > clnode190.clemson.cloudlab.us.50700: Flags [P.], seq 9667:9736, ack 53036, win 2048, length 69
09:08:17.959455 IP clnode190.clemson.cloudlab.us.50700 > 104.46.115.237.8883: Flags [.], ack 9736, win 501, length 0
09:08:18.030485 IP clnode190.clemson.cloudlab.us.50700 > 104.46.115.237.8883: Flags [P.], seq 53036:53665, ack 9736, win 501, length 629
09:08:18.058450 IP 104.46.115.237.8883 > clnode190.clemson.cloudlab.us.50700: Flags [P.], seq 9736:9805, ack 53665, win 2053, length 69
09:08:18.059358 IP clnode190.clemson.cloudlab.us.50700 > 104.46.115.237.8883: Flags [.], ack 9805, win 501, length 0
09:08:18.131544 IP clnode190.clemson.cloudlab.us.50700 > 104.46.115.237.8883: Flags [P.], seq 53665:54294, ack 9805, win 501, length 629
09:08:18.176729 IP 104.46.115.237.8883 > clnode190.clemson.cloudlab.us.50700: Flags [P.], seq 9805:9874, ack 54294, win 2050, length 69
09:08:18.177018 IP clnode190.clemson.cloudlab.us.50700 > 104.46.115.237.8883: Flags [.], ack 9874, win 501, length 0
09:08:18.231399 IP clnode190.clemson.cloudlab.us.50700 > 104.46.115.237.8883: Flags [P.], seq 54294:54923, ack 9874, win 501, length 629
09:08:18.258795 IP 104.46.115.237.8883 > clnode190.clemson.cloudlab.us.50700: Flags [P.], seq 9874:9943, ack 54923, win 2048, length 69
09:08:18.259150 IP clnode190.clemson.cloudlab.us.50700 > 104.46.115.237.8883: Flags [.], ack 9943, win 501, length 0
09:08:18.331231 IP clnode190.clemson.cloudlab.us.50700 > 104.46.115.237.8883: Flags [P.], seq 54923:55552, ack 9943, win 501, length 629
09:08:18.358873 IP 104.46.115.237.8883 > clnode190.clemson.cloudlab.us.50700: Flags [P.], seq 9943:10012, ack 55552, win 2053, length 69
09:08:18.358962 IP clnode190.clemson.cloudlab.us.50700 > 104.46.115.237.8883: Flags [.], ack 10012, win 501, length 0
09:08:18.432194 IP clnode190.clemson.cloudlab.us.50700 > 104.46.115.237.8883: Flags [P.], seq 55552:56181, ack 10012, win 501, length 629
09:08:18.459500 IP 104.46.115.237.8883 > clnode190.clemson.cloudlab.us.50700: Flags [P.], seq 10012:10081, ack 56181, win 2050, length 69
09:08:18.459994 IP clnode190.clemson.cloudlab.us.50700 > 104.46.115.237.8883: Flags [.], ack 10081, win 501, length 0
09:08:18.532114 IP clnode190.clemson.cloudlab.us.50700 > 104.46.115.237.8883: Flags [P.], seq 56181:56810, ack 10081, win 501, length 629
09:08:18.570382 IP 104.46.115.237.8883 > clnode190.clemson.cloudlab.us.50700: Flags [P.], seq 10081:10150, ack 56810, win 2048, length 69
09:08:18.571033 IP clnode190.clemson.cloudlab.us.50700 > 104.46.115.237.8883: Flags [.], ack 10150, win 501, length 0
09:08:18.632749 IP clnode190.clemson.cloudlab.us.50700 > 104.46.115.237.8883: Flags [P.], seq 56810:57439, ack 10150, win 501, length 629
09:08:18.660005 IP 104.46.115.237.8883 > clnode190.clemson.cloudlab.us.50700: Flags [P.], seq 10150:10219, ack 57439, win 2053, length 69
09:08:18.660428 IP clnode190.clemson.cloudlab.us.50700 > 104.46.115.237.8883: Flags [.], ack 10219, win 501, length 0
09:08:18.732499 IP clnode190.clemson.cloudlab.us.50700 > 104.46.115.237.8883: Flags [P.], seq 57439:58068, ack 10219, win 501, length 629
09:08:18.760003 IP 104.46.115.237.8883 > clnode190.clemson.cloudlab.us.50700: Flags [P.], seq 10219:10288, ack 58068, win 2050, length 69
09:08:18.760198 IP clnode190.clemson.cloudlab.us.50700 > 104.46.115.237.8883: Flags [.], ack 10288, win 501, length 0
09:08:18.832334 IP clnode190.clemson.cloudlab.us.50700 > 104.46.115.237.8883: Flags [P.], seq 58068:58697, ack 10288, win 501, length 629
09:08:18.859991 IP 104.46.115.237.8883 > clnode190.clemson.cloudlab.us.50700: Flags [P.], seq 10288:10357, ack 58697, win 2048, length 69
09:08:18.860042 IP clnode190.clemson.cloudlab.us.50700 > 104.46.115.237.8883: Flags [.], ack 10357, win 501, length 0
09:08:18.933188 IP clnode190.clemson.cloudlab.us.50700 > 104.46.115.237.8883: Flags [P.], seq 58697:59326, ack 10357, win 501, length 629
09:08:18.970107 IP 104.46.115.237.8883 > clnode190.clemson.cloudlab.us.50700: Flags [P.], seq 10357:10426, ack 59326, win 2053, length 69
09:08:18.970825 IP clnode190.clemson.cloudlab.us.50700 > 104.46.115.237.8883: Flags [.], ack 10426, win 501, length 0
09:08:19.033003 IP clnode190.clemson.cloudlab.us.50700 > 104.46.115.237.8883: Flags [P.], seq 59326:59955, ack 10426, win 501, length 629
09:08:19.062096 IP 104.46.115.237.8883 > clnode190.clemson.cloudlab.us.50700: Flags [P.], seq 10426:10495, ack 59955, win 2050, length 69
09:08:19.062975 IP clnode190.clemson.cloudlab.us.50700 > 104.46.115.237.8883: Flags [.], ack 10495, win 501, length 0
09:08:19.133894 IP clnode190.clemson.cloudlab.us.50700 > 104.46.115.237.8883: Flags [P.], seq 59955:60584, ack 10495, win 501, length 629
09:08:19.162329 IP 104.46.115.237.8883 > clnode190.clemson.cloudlab.us.50700: Flags [P.], seq 10495:10564, ack 60584, win 2048, length 69
09:08:19.162784 IP clnode190.clemson.cloudlab.us.50700 > 104.46.115.237.8883: Flags [.], ack 10564, win 501, length 0
09:08:19.233865 IP clnode190.clemson.cloudlab.us.50700 > 104.46.115.237.8883: Flags [P.], seq 60584:61213, ack 10564, win 501, length 629
09:08:19.262161 IP 104.46.115.237.8883 > clnode190.clemson.cloudlab.us.50700: Flags [P.], seq 10564:10633, ack 61213, win 2053, length 69
09:08:19.262717 IP clnode190.clemson.cloudlab.us.50700 > 104.46.115.237.8883: Flags [.], ack 10633, win 501, length 0
09:08:19.333783 IP clnode190.clemson.cloudlab.us.50700 > 104.46.115.237.8883: Flags [P.], seq 61213:61842, ack 10633, win 501, length 629
09:08:19.373319 IP 104.46.115.237.8883 > clnode190.clemson.cloudlab.us.50700: Flags [P.], seq 10633:10702, ack 61842, win 2050, length 69
09:08:19.373772 IP clnode190.clemson.cloudlab.us.50700 > 104.46.115.237.8883: Flags [.], ack 10702, win 501, length 0
09:08:19.434825 IP clnode190.clemson.cloudlab.us.50700 > 104.46.115.237.8883: Flags [P.], seq 61842:62471, ack 10702, win 501, length 629
09:08:19.463307 IP 104.46.115.237.8883 > clnode190.clemson.cloudlab.us.50700: Flags [P.], seq 10702:10771, ack 62471, win 2048, length 69
