12:46:40.237904 IP clnode190.clemson.cloudlab.us.47250 > 52.177.196.50.8883: Flags [S], seq 544490491, win 64240, options [mss 1460,sackOK,TS val 1889268294 ecr 0,nop,wscale 7], length 0
12:46:40.258539 IP 52.177.196.50.8883 > clnode190.clemson.cloudlab.us.47250: Flags [S.], seq 1945975156, ack 544490492, win 65535, options [mss 1440,nop,wscale 8,nop,nop,sackOK], length 0
12:46:40.258581 IP clnode190.clemson.cloudlab.us.47250 > 52.177.196.50.8883: Flags [.], ack 1, win 502, length 0
12:46:40.258804 IP clnode190.clemson.cloudlab.us.47250 > 52.177.196.50.8883: Flags [P.], seq 1:294, ack 1, win 502, length 293
12:46:40.281100 IP 52.177.196.50.8883 > clnode190.clemson.cloudlab.us.47250: Flags [P.], seq 1:3849, ack 294, win 2051, length 3848
12:46:40.281122 IP clnode190.clemson.cloudlab.us.47250 > 52.177.196.50.8883: Flags [.], ack 3849, win 487, length 0
12:46:40.283317 IP clnode190.clemson.cloudlab.us.47250 > 52.177.196.50.8883: Flags [P.], seq 294:472, ack 3849, win 501, length 178
12:46:40.304426 IP 52.177.196.50.8883 > clnode190.clemson.cloudlab.us.47250: Flags [P.], seq 3849:3940, ack 472, win 2051, length 91
12:46:40.305577 IP clnode190.clemson.cloudlab.us.47250 > 52.177.196.50.8883: Flags [P.], seq 472:829, ack 3940, win 501, length 357
12:46:40.365455 IP 52.177.196.50.8883 > clnode190.clemson.cloudlab.us.47250: Flags [.], ack 829, win 2049, length 0
12:46:40.400053 IP 52.177.196.50.8883 > clnode190.clemson.cloudlab.us.47250: Flags [P.], seq 3940:4009, ack 829, win 2049, length 69
12:46:40.403309 IP clnode190.clemson.cloudlab.us.47250 > 52.177.196.50.8883: Flags [P.], seq 829:1458, ack 4009, win 501, length 629
12:46:40.435566 IP clnode190.clemson.cloudlab.us.47250 > 52.177.196.50.8883: Flags [.], seq 1458:2898, ack 4009, win 501, length 1440
12:46:40.455711 IP 52.177.196.50.8883 > clnode190.clemson.cloudlab.us.47250: Flags [.], ack 2898, win 2053, length 0
12:46:40.455726 IP clnode190.clemson.cloudlab.us.47250 > 52.177.196.50.8883: Flags [P.], seq 2898:3345, ack 4009, win 501, length 447
12:46:40.516372 IP 52.177.196.50.8883 > clnode190.clemson.cloudlab.us.47250: Flags [.], ack 3345, win 2051, length 0
12:46:40.560847 IP clnode190.clemson.cloudlab.us.47250 > 52.177.196.50.8883: Flags [P.], seq 3345:3974, ack 4009, win 501, length 629
12:46:40.621405 IP 52.177.196.50.8883 > clnode190.clemson.cloudlab.us.47250: Flags [.], ack 3974, win 2048, length 0
12:46:40.676981 IP 52.177.196.50.8883 > clnode190.clemson.cloudlab.us.47250: Flags [P.], seq 4009:4078, ack 3974, win 2048, length 69
12:46:40.692347 IP 52.177.196.50.8883 > clnode190.clemson.cloudlab.us.47250: Flags [P.], seq 4078:4147, ack 3974, win 2048, length 69
12:46:40.692964 IP clnode190.clemson.cloudlab.us.47250 > 52.177.196.50.8883: Flags [.], ack 4147, win 501, length 0
12:46:40.698229 IP 52.177.196.50.8883 > clnode190.clemson.cloudlab.us.47250: Flags [P.], seq 4147:4216, ack 3974, win 2048, length 69
12:46:40.712554 IP 52.177.196.50.8883 > clnode190.clemson.cloudlab.us.47250: Flags [P.], seq 4216:4285, ack 3974, win 2048, length 69
12:46:40.712998 IP clnode190.clemson.cloudlab.us.47250 > 52.177.196.50.8883: Flags [.], ack 4285, win 501, length 0
12:46:40.717875 IP 52.177.196.50.8883 > clnode190.clemson.cloudlab.us.47250: Flags [P.], seq 4285:4354, ack 3974, win 2048, length 69
12:46:40.760835 IP clnode190.clemson.cloudlab.us.47250 > 52.177.196.50.8883: Flags [.], ack 4354, win 501, length 0
12:46:40.838314 IP clnode190.clemson.cloudlab.us.47250 > 52.177.196.50.8883: Flags [P.], seq 3974:4603, ack 4354, win 501, length 629
12:46:40.864645 IP 52.177.196.50.8883 > clnode190.clemson.cloudlab.us.47250: Flags [P.], seq 4354:4423, ack 4603, win 2053, length 69
12:46:40.864668 IP clnode190.clemson.cloudlab.us.47250 > 52.177.196.50.8883: Flags [.], ack 4423, win 501, length 0
12:46:40.940358 IP clnode190.clemson.cloudlab.us.47250 > 52.177.196.50.8883: Flags [P.], seq 4603:5232, ack 4423, win 501, length 629
12:46:40.966558 IP 52.177.196.50.8883 > clnode190.clemson.cloudlab.us.47250: Flags [P.], seq 4423:4492, ack 5232, win 2050, length 69
12:46:40.966572 IP clnode190.clemson.cloudlab.us.47250 > 52.177.196.50.8883: Flags [.], ack 4492, win 501, length 0
12:46:41.013499 IP clnode190.clemson.cloudlab.us.47250 > 52.177.196.50.8883: Flags [P.], seq 5232:5861, ack 4492, win 501, length 629
12:46:41.048744 IP 52.177.196.50.8883 > clnode190.clemson.cloudlab.us.47250: Flags [P.], seq 4492:4561, ack 5861, win 2048, length 69
12:46:41.048757 IP clnode190.clemson.cloudlab.us.47250 > 52.177.196.50.8883: Flags [.], ack 4561, win 501, length 0
12:46:41.116286 IP clnode190.clemson.cloudlab.us.47250 > 52.177.196.50.8883: Flags [P.], seq 5861:6490, ack 4561, win 501, length 629
12:46:41.142134 IP 52.177.196.50.8883 > clnode190.clemson.cloudlab.us.47250: Flags [P.], seq 4561:4630, ack 6490, win 2053, length 69
12:46:41.142147 IP clnode190.clemson.cloudlab.us.47250 > 52.177.196.50.8883: Flags [.], ack 4630, win 501, length 0
12:46:41.187131 IP clnode190.clemson.cloudlab.us.47250 > 52.177.196.50.8883: Flags [P.], seq 6490:7119, ack 4630, win 501, length 629
12:46:41.214009 IP 52.177.196.50.8883 > clnode190.clemson.cloudlab.us.47250: Flags [P.], seq 4630:4699, ack 7119, win 2050, length 69
12:46:41.214039 IP clnode190.clemson.cloudlab.us.47250 > 52.177.196.50.8883: Flags [.], ack 4699, win 501, length 0
12:46:41.260381 IP clnode190.clemson.cloudlab.us.47250 > 52.177.196.50.8883: Flags [P.], seq 7119:7748, ack 4699, win 501, length 629
12:46:41.286753 IP 52.177.196.50.8883 > clnode190.clemson.cloudlab.us.47250: Flags [P.], seq 4699:4768, ack 7748, win 2048, length 69
12:46:41.286782 IP clnode190.clemson.cloudlab.us.47250 > 52.177.196.50.8883: Flags [.], ack 4768, win 501, length 0
12:46:41.386712 IP clnode190.clemson.cloudlab.us.47250 > 52.177.196.50.8883: Flags [P.], seq 7748:8377, ack 4768, win 501, length 629
12:46:41.422677 IP 52.177.196.50.8883 > clnode190.clemson.cloudlab.us.47250: Flags [P.], seq 4768:4837, ack 8377, win 2053, length 69
12:46:41.423286 IP clnode190.clemson.cloudlab.us.47250 > 52.177.196.50.8883: Flags [.], ack 4837, win 501, length 0
12:46:41.656027 IP clnode190.clemson.cloudlab.us.47250 > 52.177.196.50.8883: Flags [P.], seq 8377:9006, ack 4837, win 501, length 629
12:46:41.682522 IP 52.177.196.50.8883 > clnode190.clemson.cloudlab.us.47250: Flags [P.], seq 4837:4906, ack 9006, win 2050, length 69
12:46:41.682551 IP clnode190.clemson.cloudlab.us.47250 > 52.177.196.50.8883: Flags [.], ack 4906, win 501, length 0
12:46:41.759179 IP clnode190.clemson.cloudlab.us.47250 > 52.177.196.50.8883: Flags [P.], seq 9006:9635, ack 4906, win 501, length 629
12:46:41.786435 IP 52.177.196.50.8883 > clnode190.clemson.cloudlab.us.47250: Flags [P.], seq 4906:4975, ack 9635, win 2048, length 69
12:46:41.786465 IP clnode190.clemson.cloudlab.us.47250 > 52.177.196.50.8883: Flags [.], ack 4975, win 501, length 0
12:46:41.880120 IP clnode190.clemson.cloudlab.us.47250 > 52.177.196.50.8883: Flags [P.], seq 9635:10264, ack 4975, win 501, length 629
12:46:41.907634 IP 52.177.196.50.8883 > clnode190.clemson.cloudlab.us.47250: Flags [P.], seq 4975:5044, ack 10264, win 2053, length 69
12:46:41.907663 IP clnode190.clemson.cloudlab.us.47250 > 52.177.196.50.8883: Flags [.], ack 5044, win 501, length 0
12:46:42.008955 IP clnode190.clemson.cloudlab.us.47250 > 52.177.196.50.8883: Flags [P.], seq 10264:10893, ack 5044, win 501, length 629
12:46:42.048083 IP 52.177.196.50.8883 > clnode190.clemson.cloudlab.us.47250: Flags [P.], seq 5044:5113, ack 10893, win 2050, length 69
12:46:42.048096 IP clnode190.clemson.cloudlab.us.47250 > 52.177.196.50.8883: Flags [.], ack 5113, win 501, length 0
12:46:42.154412 IP clnode190.clemson.cloudlab.us.47250 > 52.177.196.50.8883: Flags [P.], seq 10893:11522, ack 5113, win 501, length 629
12:46:42.180483 IP 52.177.196.50.8883 > clnode190.clemson.cloudlab.us.47250: Flags [P.], seq 5113:5182, ack 11522, win 2048, length 69
12:46:42.180512 IP clnode190.clemson.cloudlab.us.47250 > 52.177.196.50.8883: Flags [.], ack 5182, win 501, length 0
12:46:42.226579 IP clnode190.clemson.cloudlab.us.47250 > 52.177.196.50.8883: Flags [P.], seq 11522:12151, ack 5182, win 501, length 629
12:46:42.254029 IP 52.177.196.50.8883 > clnode190.clemson.cloudlab.us.47250: Flags [P.], seq 5182:5251, ack 12151, win 2053, length 69
12:46:42.254058 IP clnode190.clemson.cloudlab.us.47250 > 52.177.196.50.8883: Flags [.], ack 5251, win 501, length 0
12:46:42.313247 IP clnode190.clemson.cloudlab.us.47250 > 52.177.196.50.8883: Flags [P.], seq 12151:12780, ack 5251, win 501, length 629
12:46:42.349101 IP 52.177.196.50.8883 > clnode190.clemson.cloudlab.us.47250: Flags [P.], seq 5251:5320, ack 12780, win 2050, length 69
12:46:42.349130 IP clnode190.clemson.cloudlab.us.47250 > 52.177.196.50.8883: Flags [.], ack 5320, win 501, length 0
12:46:42.456559 IP clnode190.clemson.cloudlab.us.47250 > 52.177.196.50.8883: Flags [P.], seq 12780:13409, ack 5320, win 501, length 629
12:46:42.519793 IP 52.177.196.50.8883 > clnode190.clemson.cloudlab.us.47250: Flags [.], ack 13409, win 2048, length 0
12:46:42.545319 IP clnode190.clemson.cloudlab.us.47250 > 52.177.196.50.8883: Flags [P.], seq 13409:14038, ack 5320, win 501, length 629
12:46:42.609822 IP 52.177.196.50.8883 > clnode190.clemson.cloudlab.us.47250: Flags [.], ack 14038, win 2053, length 0
12:46:42.691200 IP 52.177.196.50.8883 > clnode190.clemson.cloudlab.us.47250: Flags [P.], seq 5320:5389, ack 14038, win 2053, length 69
12:46:42.691209 IP clnode190.clemson.cloudlab.us.47250 > 52.177.196.50.8883: Flags [.], ack 5389, win 501, length 0
12:46:42.697819 IP 52.177.196.50.8883 > clnode190.clemson.cloudlab.us.47250: Flags [P.], seq 5389:5458, ack 14038, win 2053, length 69
12:46:42.697828 IP clnode190.clemson.cloudlab.us.47250 > 52.177.196.50.8883: Flags [.], ack 5458, win 501, length 0
12:46:43.082438 IP clnode190.clemson.cloudlab.us.47250 > 52.177.196.50.8883: Flags [P.], seq 14038:14667, ack 5458, win 501, length 629
12:46:43.110825 IP 52.177.196.50.8883 > clnode190.clemson.cloudlab.us.47250: Flags [P.], seq 5458:5527, ack 14667, win 2050, length 69
12:46:43.110855 IP clnode190.clemson.cloudlab.us.47250 > 52.177.196.50.8883: Flags [.], ack 5527, win 501, length 0
12:46:43.224367 IP clnode190.clemson.cloudlab.us.47250 > 52.177.196.50.8883: Flags [P.], seq 14667:15296, ack 5527, win 501, length 629
12:46:43.264558 IP 52.177.196.50.8883 > clnode190.clemson.cloudlab.us.47250: Flags [P.], seq 5527:5596, ack 15296, win 2048, length 69
12:46:43.264587 IP clnode190.clemson.cloudlab.us.47250 > 52.177.196.50.8883: Flags [.], ack 5596, win 501, length 0
12:46:43.298664 IP clnode190.clemson.cloudlab.us.47250 > 52.177.196.50.8883: Flags [P.], seq 15296:15925, ack 5596, win 501, length 629
12:46:43.324897 IP 52.177.196.50.8883 > clnode190.clemson.cloudlab.us.47250: Flags [P.], seq 5596:5665, ack 15925, win 2053, length 69
12:46:43.368901 IP clnode190.clemson.cloudlab.us.47250 > 52.177.196.50.8883: Flags [.], ack 5665, win 501, length 0
12:46:43.507111 IP clnode190.clemson.cloudlab.us.47250 > 52.177.196.50.8883: Flags [P.], seq 15925:16554, ack 5665, win 501, length 629
12:46:43.534442 IP 52.177.196.50.8883 > clnode190.clemson.cloudlab.us.47250: Flags [P.], seq 5665:5734, ack 16554, win 2050, length 69
12:46:43.534471 IP clnode190.clemson.cloudlab.us.47250 > 52.177.196.50.8883: Flags [.], ack 5734, win 501, length 0
12:46:43.601341 IP clnode190.clemson.cloudlab.us.47250 > 52.177.196.50.8883: Flags [P.], seq 16554:17183, ack 5734, win 501, length 629
12:46:43.628073 IP 52.177.196.50.8883 > clnode190.clemson.cloudlab.us.47250: Flags [P.], seq 5734:5803, ack 17183, win 2048, length 69
12:46:43.628102 IP clnode190.clemson.cloudlab.us.47250 > 52.177.196.50.8883: Flags [.], ack 5803, win 501, length 0
12:46:43.700090 IP clnode190.clemson.cloudlab.us.47250 > 52.177.196.50.8883: Flags [P.], seq 17183:17812, ack 5803, win 501, length 629
12:46:43.736994 IP 52.177.196.50.8883 > clnode190.clemson.cloudlab.us.47250: Flags [P.], seq 5803:5872, ack 17812, win 2053, length 69
12:46:43.737006 IP clnode190.clemson.cloudlab.us.47250 > 52.177.196.50.8883: Flags [.], ack 5872, win 501, length 0
12:46:43.783389 IP clnode190.clemson.cloudlab.us.47250 > 52.177.196.50.8883: Flags [P.], seq 17812:18441, ack 5872, win 501, length 629
12:46:43.810132 IP 52.177.196.50.8883 > clnode190.clemson.cloudlab.us.47250: Flags [P.], seq 5872:5941, ack 18441, win 2050, length 69
12:46:43.810161 IP clnode190.clemson.cloudlab.us.47250 > 52.177.196.50.8883: Flags [.], ack 5941, win 501, length 0
12:46:43.860010 IP clnode190.clemson.cloudlab.us.47250 > 52.177.196.50.8883: Flags [P.], seq 18441:19070, ack 5941, win 501, length 629
12:46:43.886278 IP 52.177.196.50.8883 > clnode190.clemson.cloudlab.us.47250: Flags [P.], seq 5941:6010, ack 19070, win 2048, length 69
12:46:43.886307 IP clnode190.clemson.cloudlab.us.47250 > 52.177.196.50.8883: Flags [.], ack 6010, win 501, length 0
12:46:44.081955 IP clnode190.clemson.cloudlab.us.47250 > 52.177.196.50.8883: Flags [P.], seq 19070:19699, ack 6010, win 501, length 629
12:46:44.108274 IP 52.177.196.50.8883 > clnode190.clemson.cloudlab.us.47250: Flags [P.], seq 6010:6079, ack 19699, win 2053, length 69
12:46:44.108626 IP clnode190.clemson.cloudlab.us.47250 > 52.177.196.50.8883: Flags [.], ack 6079, win 501, length 0
12:46:44.155310 IP clnode190.clemson.cloudlab.us.47250 > 52.177.196.50.8883: Flags [P.], seq 19699:20328, ack 6079, win 501, length 629
12:46:44.190860 IP 52.177.196.50.8883 > clnode190.clemson.cloudlab.us.47250: Flags [P.], seq 6079:6148, ack 20328, win 2050, length 69
12:46:44.191946 IP clnode190.clemson.cloudlab.us.47250 > 52.177.196.50.8883: Flags [.], ack 6148, win 501, length 0
12:46:44.255229 IP clnode190.clemson.cloudlab.us.47250 > 52.177.196.50.8883: Flags [P.], seq 20328:20957, ack 6148, win 501, length 629
12:46:44.284530 IP 52.177.196.50.8883 > clnode190.clemson.cloudlab.us.47250: Flags [P.], seq 6148:6217, ack 20957, win 2048, length 69
12:46:44.285229 IP clnode190.clemson.cloudlab.us.47250 > 52.177.196.50.8883: Flags [.], ack 6217, win 501, length 0
12:46:44.341912 IP clnode190.clemson.cloudlab.us.47250 > 52.177.196.50.8883: Flags [P.], seq 20957:21586, ack 6217, win 501, length 629
12:46:44.368434 IP 52.177.196.50.8883 > clnode190.clemson.cloudlab.us.47250: Flags [P.], seq 6217:6286, ack 21586, win 2053, length 69
12:46:44.368568 IP clnode190.clemson.cloudlab.us.47250 > 52.177.196.50.8883: Flags [.], ack 6286, win 501, length 0
12:46:44.440675 IP clnode190.clemson.cloudlab.us.47250 > 52.177.196.50.8883: Flags [P.], seq 21586:22215, ack 6286, win 501, length 629
12:46:44.480913 IP 52.177.196.50.8883 > clnode190.clemson.cloudlab.us.47250: Flags [P.], seq 6286:6355, ack 22215, win 2050, length 69
12:46:44.481788 IP clnode190.clemson.cloudlab.us.47250 > 52.177.196.50.8883: Flags [.], ack 6355, win 501, length 0
12:46:44.515132 IP clnode190.clemson.cloudlab.us.47250 > 52.177.196.50.8883: Flags [P.], seq 22215:22844, ack 6355, win 501, length 629
12:46:44.542575 IP 52.177.196.50.8883 > clnode190.clemson.cloudlab.us.47250: Flags [P.], seq 6355:6424, ack 22844, win 2048, length 69
12:46:44.584902 IP clnode190.clemson.cloudlab.us.47250 > 52.177.196.50.8883: Flags [.], ack 6424, win 501, length 0
12:46:44.588309 IP clnode190.clemson.cloudlab.us.47250 > 52.177.196.50.8883: Flags [P.], seq 22844:23473, ack 6424, win 501, length 629
12:46:44.617195 IP 52.177.196.50.8883 > clnode190.clemson.cloudlab.us.47250: Flags [P.], seq 6424:6493, ack 23473, win 2053, length 69
12:46:44.618231 IP clnode190.clemson.cloudlab.us.47250 > 52.177.196.50.8883: Flags [.], ack 6493, win 501, length 0
12:46:44.678143 IP clnode190.clemson.cloudlab.us.47250 > 52.177.196.50.8883: Flags [P.], seq 23473:24102, ack 6493, win 501, length 629
12:46:44.704023 IP 52.177.196.50.8883 > clnode190.clemson.cloudlab.us.47250: Flags [P.], seq 6493:6562, ack 24102, win 2050, length 69
12:46:44.704831 IP clnode190.clemson.cloudlab.us.47250 > 52.177.196.50.8883: Flags [.], ack 6562, win 501, length 0
12:46:44.920027 IP clnode190.clemson.cloudlab.us.47250 > 52.177.196.50.8883: Flags [P.], seq 24102:24731, ack 6562, win 501, length 629
12:46:44.955864 IP 52.177.196.50.8883 > clnode190.clemson.cloudlab.us.47250: Flags [P.], seq 6562:6631, ack 24731, win 2048, length 69
12:46:44.955894 IP clnode190.clemson.cloudlab.us.47250 > 52.177.196.50.8883: Flags [.], ack 6631, win 501, length 0
12:46:45.017501 IP clnode190.clemson.cloudlab.us.47250 > 52.177.196.50.8883: Flags [P.], seq 24731:25360, ack 6631, win 501, length 629
12:46:45.044094 IP 52.177.196.50.8883 > clnode190.clemson.cloudlab.us.47250: Flags [P.], seq 6631:6700, ack 25360, win 2053, length 69
12:46:45.044124 IP clnode190.clemson.cloudlab.us.47250 > 52.177.196.50.8883: Flags [.], ack 6700, win 501, length 0
12:46:45.089483 IP clnode190.clemson.cloudlab.us.47250 > 52.177.196.50.8883: Flags [P.], seq 25360:25989, ack 6700, win 501, length 629
12:46:45.125553 IP 52.177.196.50.8883 > clnode190.clemson.cloudlab.us.47250: Flags [P.], seq 6700:6769, ack 25989, win 2050, length 69
12:46:45.125582 IP clnode190.clemson.cloudlab.us.47250 > 52.177.196.50.8883: Flags [.], ack 6769, win 501, length 0
12:46:45.237603 IP clnode190.clemson.cloudlab.us.47250 > 52.177.196.50.8883: Flags [P.], seq 25989:26618, ack 6769, win 501, length 629
12:46:45.264404 IP 52.177.196.50.8883 > clnode190.clemson.cloudlab.us.47250: Flags [P.], seq 6769:6838, ack 26618, win 2048, length 69
12:46:45.264433 IP clnode190.clemson.cloudlab.us.47250 > 52.177.196.50.8883: Flags [.], ack 6838, win 501, length 0
12:46:45.313128 IP clnode190.clemson.cloudlab.us.47250 > 52.177.196.50.8883: Flags [P.], seq 26618:27247, ack 6838, win 501, length 629
12:46:45.349475 IP 52.177.196.50.8883 > clnode190.clemson.cloudlab.us.47250: Flags [P.], seq 6838:6907, ack 27247, win 2053, length 69
12:46:45.349505 IP clnode190.clemson.cloudlab.us.47250 > 52.177.196.50.8883: Flags [.], ack 6907, win 501, length 0
12:46:45.439638 IP clnode190.clemson.cloudlab.us.47250 > 52.177.196.50.8883: Flags [P.], seq 27247:27876, ack 6907, win 501, length 629
12:46:45.465831 IP 52.177.196.50.8883 > clnode190.clemson.cloudlab.us.47250: Flags [P.], seq 6907:6976, ack 27876, win 2050, length 69
12:46:45.465861 IP clnode190.clemson.cloudlab.us.47250 > 52.177.196.50.8883: Flags [.], ack 6976, win 501, length 0
12:46:45.556227 IP clnode190.clemson.cloudlab.us.47250 > 52.177.196.50.8883: Flags [P.], seq 27876:28505, ack 6976, win 501, length 629
12:46:45.582029 IP 52.177.196.50.8883 > clnode190.clemson.cloudlab.us.47250: Flags [P.], seq 6976:7045, ack 28505, win 2048, length 69
12:46:45.582058 IP clnode190.clemson.cloudlab.us.47250 > 52.177.196.50.8883: Flags [.], ack 7045, win 501, length 0
12:46:45.691613 IP clnode190.clemson.cloudlab.us.47250 > 52.177.196.50.8883: Flags [P.], seq 28505:29134, ack 7045, win 501, length 629
12:46:45.718472 IP 52.177.196.50.8883 > clnode190.clemson.cloudlab.us.47250: Flags [P.], seq 7045:7114, ack 29134, win 2053, length 69
12:46:45.718501 IP clnode190.clemson.cloudlab.us.47250 > 52.177.196.50.8883: Flags [.], ack 7114, win 501, length 0
12:46:45.903366 IP clnode190.clemson.cloudlab.us.47250 > 52.177.196.50.8883: Flags [P.], seq 29134:29763, ack 7114, win 501, length 629
12:46:45.939295 IP 52.177.196.50.8883 > clnode190.clemson.cloudlab.us.47250: Flags [P.], seq 7114:7183, ack 29763, win 2050, length 69
12:46:45.940020 IP clnode190.clemson.cloudlab.us.47250 > 52.177.196.50.8883: Flags [.], ack 7183, win 501, length 0
12:46:45.988847 IP clnode190.clemson.cloudlab.us.47250 > 52.177.196.50.8883: Flags [P.], seq 29763:30392, ack 7183, win 501, length 629
12:46:46.015330 IP 52.177.196.50.8883 > clnode190.clemson.cloudlab.us.47250: Flags [P.], seq 7183:7252, ack 30392, win 2048, length 69
12:46:46.015501 IP clnode190.clemson.cloudlab.us.47250 > 52.177.196.50.8883: Flags [.], ack 7252, win 501, length 0
12:46:46.089749 IP clnode190.clemson.cloudlab.us.47250 > 52.177.196.50.8883: Flags [P.], seq 30392:31021, ack 7252, win 501, length 629
12:46:46.123245 IP 52.177.196.50.8883 > clnode190.clemson.cloudlab.us.47250: Flags [P.], seq 7252:7321, ack 31021, win 2053, length 69
12:46:46.124095 IP clnode190.clemson.cloudlab.us.47250 > 52.177.196.50.8883: Flags [.], ack 7321, win 501, length 0
12:46:46.270484 IP clnode190.clemson.cloudlab.us.47250 > 52.177.196.50.8883: Flags [P.], seq 31021:31650, ack 7321, win 501, length 629
12:46:46.306744 IP 52.177.196.50.8883 > clnode190.clemson.cloudlab.us.47250: Flags [P.], seq 7321:7390, ack 31650, win 2050, length 69
12:46:46.307126 IP clnode190.clemson.cloudlab.us.47250 > 52.177.196.50.8883: Flags [.], ack 7390, win 501, length 0
12:46:46.449207 IP clnode190.clemson.cloudlab.us.47250 > 52.177.196.50.8883: Flags [P.], seq 31650:32279, ack 7390, win 501, length 629
12:46:46.475479 IP 52.177.196.50.8883 > clnode190.clemson.cloudlab.us.47250: Flags [P.], seq 7390:7459, ack 32279, win 2048, length 69
12:46:46.475838 IP clnode190.clemson.cloudlab.us.47250 > 52.177.196.50.8883: Flags [.], ack 7459, win 501, length 0
12:46:46.541348 IP clnode190.clemson.cloudlab.us.47250 > 52.177.196.50.8883: Flags [P.], seq 32279:32908, ack 7459, win 501, length 629
12:46:46.567988 IP 52.177.196.50.8883 > clnode190.clemson.cloudlab.us.47250: Flags [P.], seq 7459:7528, ack 32908, win 2053, length 69
12:46:46.569120 IP clnode190.clemson.cloudlab.us.47250 > 52.177.196.50.8883: Flags [.], ack 7528, win 501, length 0
12:46:46.637921 IP clnode190.clemson.cloudlab.us.47250 > 52.177.196.50.8883: Flags [P.], seq 32908:33537, ack 7528, win 501, length 629
12:46:46.664620 IP 52.177.196.50.8883 > clnode190.clemson.cloudlab.us.47250: Flags [P.], seq 7528:7597, ack 33537, win 2050, length 69
12:46:46.665672 IP clnode190.clemson.cloudlab.us.47250 > 52.177.196.50.8883: Flags [.], ack 7597, win 501, length 0
12:46:46.716776 IP clnode190.clemson.cloudlab.us.47250 > 52.177.196.50.8883: Flags [P.], seq 33537:34166, ack 7597, win 501, length 629
12:46:46.751894 IP 52.177.196.50.8883 > clnode190.clemson.cloudlab.us.47250: Flags [P.], seq 7597:7666, ack 34166, win 2048, length 69
12:46:46.752349 IP clnode190.clemson.cloudlab.us.47250 > 52.177.196.50.8883: Flags [.], ack 7666, win 501, length 0
12:46:46.824417 IP clnode190.clemson.cloudlab.us.47250 > 52.177.196.50.8883: Flags [P.], seq 34166:34795, ack 7666, win 501, length 629
12:46:46.853642 IP 52.177.196.50.8883 > clnode190.clemson.cloudlab.us.47250: Flags [P.], seq 7666:7735, ack 34795, win 2053, length 69
12:46:46.854377 IP clnode190.clemson.cloudlab.us.47250 > 52.177.196.50.8883: Flags [.], ack 7735, win 501, length 0
12:46:46.897679 IP clnode190.clemson.cloudlab.us.47250 > 52.177.196.50.8883: Flags [P.], seq 34795:35424, ack 7735, win 501, length 629
12:46:46.923464 IP 52.177.196.50.8883 > clnode190.clemson.cloudlab.us.47250: Flags [P.], seq 7735:7804, ack 35424, win 2050, length 69
12:46:46.924382 IP clnode190.clemson.cloudlab.us.47250 > 52.177.196.50.8883: Flags [.], ack 7804, win 501, length 0
12:46:46.997645 IP clnode190.clemson.cloudlab.us.47250 > 52.177.196.50.8883: Flags [P.], seq 35424:36053, ack 7804, win 501, length 629
12:46:47.024063 IP 52.177.196.50.8883 > clnode190.clemson.cloudlab.us.47250: Flags [P.], seq 7804:7873, ack 36053, win 2048, length 69
12:46:47.024313 IP clnode190.clemson.cloudlab.us.47250 > 52.177.196.50.8883: Flags [.], ack 7873, win 501, length 0
12:46:47.138559 IP clnode190.clemson.cloudlab.us.47250 > 52.177.196.50.8883: Flags [P.], seq 36053:36682, ack 7873, win 501, length 629
12:46:47.173741 IP 52.177.196.50.8883 > clnode190.clemson.cloudlab.us.47250: Flags [P.], seq 7873:7942, ack 36682, win 2053, length 69
12:46:47.173777 IP clnode190.clemson.cloudlab.us.47250 > 52.177.196.50.8883: Flags [.], ack 7942, win 501, length 0
12:46:47.353438 IP clnode190.clemson.cloudlab.us.47250 > 52.177.196.50.8883: Flags [P.], seq 36682:37311, ack 7942, win 501, length 629
12:46:47.379493 IP 52.177.196.50.8883 > clnode190.clemson.cloudlab.us.47250: Flags [P.], seq 7942:8011, ack 37311, win 2050, length 69
12:46:47.380104 IP clnode190.clemson.cloudlab.us.47250 > 52.177.196.50.8883: Flags [.], ack 8011, win 501, length 0
12:46:47.530900 IP clnode190.clemson.cloudlab.us.47250 > 52.177.196.50.8883: Flags [P.], seq 37311:37940, ack 8011, win 501, length 629
12:46:47.557395 IP 52.177.196.50.8883 > clnode190.clemson.cloudlab.us.47250: Flags [P.], seq 8011:8080, ack 37940, win 2048, length 69
12:46:47.557512 IP clnode190.clemson.cloudlab.us.47250 > 52.177.196.50.8883: Flags [.], ack 8080, win 501, length 0
12:46:47.611928 IP clnode190.clemson.cloudlab.us.47250 > 52.177.196.50.8883: Flags [P.], seq 37940:38569, ack 8080, win 501, length 629
12:46:47.645977 IP 52.177.196.50.8883 > clnode190.clemson.cloudlab.us.47250: Flags [P.], seq 8080:8149, ack 38569, win 2053, length 69
12:46:47.646327 IP clnode190.clemson.cloudlab.us.47250 > 52.177.196.50.8883: Flags [.], ack 8149, win 501, length 0
12:46:47.687222 IP clnode190.clemson.cloudlab.us.47250 > 52.177.196.50.8883: Flags [P.], seq 38569:39198, ack 8149, win 501, length 629
12:46:47.722725 IP 52.177.196.50.8883 > clnode190.clemson.cloudlab.us.47250: Flags [P.], seq 8149:8218, ack 39198, win 2050, length 69
12:46:47.723835 IP clnode190.clemson.cloudlab.us.47250 > 52.177.196.50.8883: Flags [.], ack 8218, win 501, length 0
12:46:47.770371 IP clnode190.clemson.cloudlab.us.47250 > 52.177.196.50.8883: Flags [P.], seq 39198:39827, ack 8218, win 501, length 629
12:46:47.807552 IP 52.177.196.50.8883 > clnode190.clemson.cloudlab.us.47250: Flags [P.], seq 8218:8287, ack 39827, win 2048, length 69
12:46:47.808051 IP clnode190.clemson.cloudlab.us.47250 > 52.177.196.50.8883: Flags [.], ack 8287, win 501, length 0
12:46:47.863553 IP clnode190.clemson.cloudlab.us.47250 > 52.177.196.50.8883: Flags [P.], seq 39827:40456, ack 8287, win 501, length 629
12:46:47.891419 IP 52.177.196.50.8883 > clnode190.clemson.cloudlab.us.47250: Flags [P.], seq 8287:8356, ack 40456, win 2053, length 69
12:46:47.892393 IP clnode190.clemson.cloudlab.us.47250 > 52.177.196.50.8883: Flags [.], ack 8356, win 501, length 0
12:46:47.994471 IP clnode190.clemson.cloudlab.us.47250 > 52.177.196.50.8883: Flags [P.], seq 40456:41085, ack 8356, win 501, length 629
12:46:48.023026 IP 52.177.196.50.8883 > clnode190.clemson.cloudlab.us.47250: Flags [P.], seq 8356:8425, ack 41085, win 2050, length 69
12:46:48.023360 IP clnode190.clemson.cloudlab.us.47250 > 52.177.196.50.8883: Flags [.], ack 8425, win 501, length 0
12:46:48.075528 IP clnode190.clemson.cloudlab.us.47250 > 52.177.196.50.8883: Flags [P.], seq 41085:41714, ack 8425, win 501, length 629
12:46:48.113651 IP 52.177.196.50.8883 > clnode190.clemson.cloudlab.us.47250: Flags [P.], seq 8425:8494, ack 41714, win 2048, length 69
12:46:48.114407 IP clnode190.clemson.cloudlab.us.47250 > 52.177.196.50.8883: Flags [.], ack 8494, win 501, length 0
12:46:48.161051 IP clnode190.clemson.cloudlab.us.47250 > 52.177.196.50.8883: Flags [P.], seq 41714:42343, ack 8494, win 501, length 629
12:46:48.193442 IP 52.177.196.50.8883 > clnode190.clemson.cloudlab.us.47250: Flags [P.], seq 8494:8563, ack 42343, win 2053, length 69
12:46:48.194363 IP clnode190.clemson.cloudlab.us.47250 > 52.177.196.50.8883: Flags [.], ack 8563, win 501, length 0
12:46:48.281104 IP clnode190.clemson.cloudlab.us.47250 > 52.177.196.50.8883: Flags [P.], seq 42343:42972, ack 8563, win 501, length 629
12:46:48.309955 IP 52.177.196.50.8883 > clnode190.clemson.cloudlab.us.47250: Flags [P.], seq 8563:8632, ack 42972, win 2050, length 69
12:46:48.309999 IP clnode190.clemson.cloudlab.us.47250 > 52.177.196.50.8883: Flags [.], ack 8632, win 501, length 0
12:46:48.406500 IP clnode190.clemson.cloudlab.us.47250 > 52.177.196.50.8883: Flags [P.], seq 42972:43601, ack 8632, win 501, length 629
12:46:48.442252 IP 52.177.196.50.8883 > clnode190.clemson.cloudlab.us.47250: Flags [P.], seq 8632:8701, ack 43601, win 2048, length 69
12:46:48.443205 IP clnode190.clemson.cloudlab.us.47250 > 52.177.196.50.8883: Flags [.], ack 8701, win 501, length 0
12:46:48.496493 IP clnode190.clemson.cloudlab.us.47250 > 52.177.196.50.8883: Flags [P.], seq 43601:44230, ack 8701, win 501, length 629
12:46:48.522864 IP 52.177.196.50.8883 > clnode190.clemson.cloudlab.us.47250: Flags [P.], seq 8701:8770, ack 44230, win 2053, length 69
12:46:48.523178 IP clnode190.clemson.cloudlab.us.47250 > 52.177.196.50.8883: Flags [.], ack 8770, win 501, length 0
12:46:48.573057 IP clnode190.clemson.cloudlab.us.47250 > 52.177.196.50.8883: Flags [P.], seq 44230:44859, ack 8770, win 501, length 629
12:46:48.599778 IP 52.177.196.50.8883 > clnode190.clemson.cloudlab.us.47250: Flags [P.], seq 8770:8839, ack 44859, win 2050, length 69
12:46:48.600783 IP clnode190.clemson.cloudlab.us.47250 > 52.177.196.50.8883: Flags [.], ack 8839, win 501, length 0
12:46:48.752847 IP clnode190.clemson.cloudlab.us.47250 > 52.177.196.50.8883: Flags [P.], seq 44859:45488, ack 8839, win 501, length 629
12:46:48.779148 IP 52.177.196.50.8883 > clnode190.clemson.cloudlab.us.47250: Flags [P.], seq 8839:8908, ack 45488, win 2048, length 69
12:46:48.779494 IP clnode190.clemson.cloudlab.us.47250 > 52.177.196.50.8883: Flags [.], ack 8908, win 501, length 0
12:46:49.089492 IP clnode190.clemson.cloudlab.us.47250 > 52.177.196.50.8883: Flags [P.], seq 45488:46117, ack 8908, win 501, length 629
12:46:49.124857 IP 52.177.196.50.8883 > clnode190.clemson.cloudlab.us.47250: Flags [P.], seq 8908:8977, ack 46117, win 2053, length 69
12:46:49.124887 IP clnode190.clemson.cloudlab.us.47250 > 52.177.196.50.8883: Flags [.], ack 8977, win 501, length 0
12:46:49.165857 IP clnode190.clemson.cloudlab.us.47250 > 52.177.196.50.8883: Flags [P.], seq 46117:46746, ack 8977, win 501, length 629
12:46:49.203970 IP 52.177.196.50.8883 > clnode190.clemson.cloudlab.us.47250: Flags [P.], seq 8977:9046, ack 46746, win 2050, length 69
12:46:49.203998 IP clnode190.clemson.cloudlab.us.47250 > 52.177.196.50.8883: Flags [.], ack 9046, win 501, length 0
12:46:49.257537 IP clnode190.clemson.cloudlab.us.47250 > 52.177.196.50.8883: Flags [P.], seq 46746:47375, ack 9046, win 501, length 629
12:46:49.283756 IP 52.177.196.50.8883 > clnode190.clemson.cloudlab.us.47250: Flags [P.], seq 9046:9115, ack 47375, win 2048, length 69
12:46:49.283768 IP clnode190.clemson.cloudlab.us.47250 > 52.177.196.50.8883: Flags [.], ack 9115, win 501, length 0
12:46:49.365187 IP clnode190.clemson.cloudlab.us.47250 > 52.177.196.50.8883: Flags [P.], seq 47375:48004, ack 9115, win 501, length 629
12:46:49.394868 IP 52.177.196.50.8883 > clnode190.clemson.cloudlab.us.47250: Flags [P.], seq 9115:9184, ack 48004, win 2053, length 69
12:46:49.394897 IP clnode190.clemson.cloudlab.us.47250 > 52.177.196.50.8883: Flags [.], ack 9184, win 501, length 0
12:46:49.463989 IP clnode190.clemson.cloudlab.us.47250 > 52.177.196.50.8883: Flags [P.], seq 48004:48633, ack 9184, win 501, length 629
12:46:49.499392 IP 52.177.196.50.8883 > clnode190.clemson.cloudlab.us.47250: Flags [P.], seq 9184:9253, ack 48633, win 2050, length 69
12:46:49.499404 IP clnode190.clemson.cloudlab.us.47250 > 52.177.196.50.8883: Flags [.], ack 9253, win 501, length 0
12:46:49.823993 IP clnode190.clemson.cloudlab.us.47250 > 52.177.196.50.8883: Flags [P.], seq 48633:49262, ack 9253, win 501, length 629
12:46:49.850257 IP 52.177.196.50.8883 > clnode190.clemson.cloudlab.us.47250: Flags [P.], seq 9253:9322, ack 49262, win 2048, length 69
12:46:49.850286 IP clnode190.clemson.cloudlab.us.47250 > 52.177.196.50.8883: Flags [.], ack 9322, win 501, length 0
12:46:49.902763 IP clnode190.clemson.cloudlab.us.47250 > 52.177.196.50.8883: Flags [P.], seq 49262:49891, ack 9322, win 501, length 629
12:46:49.937724 IP 52.177.196.50.8883 > clnode190.clemson.cloudlab.us.47250: Flags [P.], seq 9322:9391, ack 49891, win 2053, length 69
12:46:49.937753 IP clnode190.clemson.cloudlab.us.47250 > 52.177.196.50.8883: Flags [.], ack 9391, win 501, length 0
12:46:50.019221 IP clnode190.clemson.cloudlab.us.47250 > 52.177.196.50.8883: Flags [P.], seq 49891:50520, ack 9391, win 501, length 629
12:46:50.045639 IP 52.177.196.50.8883 > clnode190.clemson.cloudlab.us.47250: Flags [P.], seq 9391:9460, ack 50520, win 2050, length 69
12:46:50.045669 IP clnode190.clemson.cloudlab.us.47250 > 52.177.196.50.8883: Flags [.], ack 9460, win 501, length 0
12:46:50.138950 IP clnode190.clemson.cloudlab.us.47250 > 52.177.196.50.8883: Flags [P.], seq 50520:51149, ack 9460, win 501, length 629
12:46:50.174522 IP 52.177.196.50.8883 > clnode190.clemson.cloudlab.us.47250: Flags [P.], seq 9460:9529, ack 51149, win 2048, length 69
12:46:50.174551 IP clnode190.clemson.cloudlab.us.47250 > 52.177.196.50.8883: Flags [.], ack 9529, win 501, length 0
12:46:50.298555 IP clnode190.clemson.cloudlab.us.47250 > 52.177.196.50.8883: Flags [P.], seq 51149:51778, ack 9529, win 501, length 629
12:46:50.324570 IP 52.177.196.50.8883 > clnode190.clemson.cloudlab.us.47250: Flags [P.], seq 9529:9598, ack 51778, win 2053, length 69
12:46:50.324598 IP clnode190.clemson.cloudlab.us.47250 > 52.177.196.50.8883: Flags [.], ack 9598, win 501, length 0
12:46:50.397266 IP clnode190.clemson.cloudlab.us.47250 > 52.177.196.50.8883: Flags [P.], seq 51778:52407, ack 9598, win 501, length 629
12:46:50.422922 IP 52.177.196.50.8883 > clnode190.clemson.cloudlab.us.47250: Flags [P.], seq 9598:9667, ack 52407, win 2050, length 69
12:46:50.422952 IP clnode190.clemson.cloudlab.us.47250 > 52.177.196.50.8883: Flags [.], ack 9667, win 501, length 0
12:46:50.476107 IP clnode190.clemson.cloudlab.us.47250 > 52.177.196.50.8883: Flags [P.], seq 52407:53036, ack 9667, win 501, length 629
12:46:50.511631 IP 52.177.196.50.8883 > clnode190.clemson.cloudlab.us.47250: Flags [P.], seq 9667:9736, ack 53036, win 2048, length 69
12:46:50.511660 IP clnode190.clemson.cloudlab.us.47250 > 52.177.196.50.8883: Flags [.], ack 9736, win 501, length 0
12:46:50.702413 IP clnode190.clemson.cloudlab.us.47250 > 52.177.196.50.8883: Flags [P.], seq 53036:53665, ack 9736, win 501, length 629
12:46:50.735224 IP 52.177.196.50.8883 > clnode190.clemson.cloudlab.us.47250: Flags [P.], seq 9736:9805, ack 53665, win 2053, length 69
12:46:50.735253 IP clnode190.clemson.cloudlab.us.47250 > 52.177.196.50.8883: Flags [.], ack 9805, win 501, length 0
12:46:50.779024 IP clnode190.clemson.cloudlab.us.47250 > 52.177.196.50.8883: Flags [P.], seq 53665:54294, ack 9805, win 501, length 629
12:46:50.809495 IP 52.177.196.50.8883 > clnode190.clemson.cloudlab.us.47250: Flags [P.], seq 9805:9874, ack 54294, win 2050, length 69
12:46:50.810053 IP clnode190.clemson.cloudlab.us.47250 > 52.177.196.50.8883: Flags [.], ack 9874, win 501, length 0
12:46:50.871064 IP clnode190.clemson.cloudlab.us.47250 > 52.177.196.50.8883: Flags [P.], seq 54294:54923, ack 9874, win 501, length 629
12:46:50.896961 IP 52.177.196.50.8883 > clnode190.clemson.cloudlab.us.47250: Flags [P.], seq 9874:9943, ack 54923, win 2048, length 69
12:46:50.897667 IP clnode190.clemson.cloudlab.us.47250 > 52.177.196.50.8883: Flags [.], ack 9943, win 501, length 0
12:46:51.080659 IP clnode190.clemson.cloudlab.us.47250 > 52.177.196.50.8883: Flags [P.], seq 54923:55552, ack 9943, win 501, length 629
12:46:51.117668 IP 52.177.196.50.8883 > clnode190.clemson.cloudlab.us.47250: Flags [P.], seq 9943:10012, ack 55552, win 2053, length 69
12:46:51.118401 IP clnode190.clemson.cloudlab.us.47250 > 52.177.196.50.8883: Flags [.], ack 10012, win 501, length 0
12:46:51.157213 IP clnode190.clemson.cloudlab.us.47250 > 52.177.196.50.8883: Flags [P.], seq 55552:56181, ack 10012, win 501, length 629
12:46:51.184410 IP 52.177.196.50.8883 > clnode190.clemson.cloudlab.us.47250: Flags [P.], seq 10012:10081, ack 56181, win 2050, length 69
12:46:51.184940 IP clnode190.clemson.cloudlab.us.47250 > 52.177.196.50.8883: Flags [.], ack 10081, win 501, length 0
12:46:51.246914 IP clnode190.clemson.cloudlab.us.47250 > 52.177.196.50.8883: Flags [P.], seq 56181:56810, ack 10081, win 501, length 629
12:46:51.273164 IP 52.177.196.50.8883 > clnode190.clemson.cloudlab.us.47250: Flags [P.], seq 10081:10150, ack 56810, win 2048, length 69
12:46:51.273549 IP clnode190.clemson.cloudlab.us.47250 > 52.177.196.50.8883: Flags [.], ack 10150, win 501, length 0
12:46:51.323504 IP clnode190.clemson.cloudlab.us.47250 > 52.177.196.50.8883: Flags [P.], seq 56810:57439, ack 10150, win 501, length 629
12:46:51.349710 IP 52.177.196.50.8883 > clnode190.clemson.cloudlab.us.47250: Flags [P.], seq 10150:10219, ack 57439, win 2053, length 69
12:46:51.350149 IP clnode190.clemson.cloudlab.us.47250 > 52.177.196.50.8883: Flags [.], ack 10219, win 501, length 0
12:46:51.418919 IP clnode190.clemson.cloudlab.us.47250 > 52.177.196.50.8883: Flags [P.], seq 57439:58068, ack 10219, win 501, length 629
12:46:51.454982 IP 52.177.196.50.8883 > clnode190.clemson.cloudlab.us.47250: Flags [P.], seq 10219:10288, ack 58068, win 2050, length 69
12:46:51.455605 IP clnode190.clemson.cloudlab.us.47250 > 52.177.196.50.8883: Flags [.], ack 10288, win 501, length 0
12:46:51.514501 IP clnode190.clemson.cloudlab.us.47250 > 52.177.196.50.8883: Flags [P.], seq 58068:58697, ack 10288, win 501, length 629
12:46:51.541048 IP 52.177.196.50.8883 > clnode190.clemson.cloudlab.us.47250: Flags [P.], seq 10288:10357, ack 58697, win 2048, length 69
12:46:51.541141 IP clnode190.clemson.cloudlab.us.47250 > 52.177.196.50.8883: Flags [.], ack 10357, win 501, length 0
12:46:51.786210 IP clnode190.clemson.cloudlab.us.47250 > 52.177.196.50.8883: Flags [P.], seq 58697:59326, ack 10357, win 501, length 629
12:46:51.813218 IP 52.177.196.50.8883 > clnode190.clemson.cloudlab.us.47250: Flags [P.], seq 10357:10426, ack 59326, win 2053, length 69
12:46:51.813247 IP clnode190.clemson.cloudlab.us.47250 > 52.177.196.50.8883: Flags [.], ack 10426, win 501, length 0
12:46:51.866108 IP clnode190.clemson.cloudlab.us.47250 > 52.177.196.50.8883: Flags [P.], seq 59326:59955, ack 10426, win 501, length 629
12:46:51.892843 IP 52.177.196.50.8883 > clnode190.clemson.cloudlab.us.47250: Flags [P.], seq 10426:10495, ack 59955, win 2050, length 69
12:46:51.892871 IP clnode190.clemson.cloudlab.us.47250 > 52.177.196.50.8883: Flags [.], ack 10495, win 501, length 0
12:46:52.101052 IP clnode190.clemson.cloudlab.us.47250 > 52.177.196.50.8883: Flags [P.], seq 59955:60584, ack 10495, win 501, length 629
12:46:52.137968 IP 52.177.196.50.8883 > clnode190.clemson.cloudlab.us.47250: Flags [P.], seq 10495:10564, ack 60584, win 2048, length 69
12:46:52.137980 IP clnode190.clemson.cloudlab.us.47250 > 52.177.196.50.8883: Flags [.], ack 10564, win 501, length 0
12:46:52.291704 IP clnode190.clemson.cloudlab.us.47250 > 52.177.196.50.8883: Flags [P.], seq 60584:61213, ack 10564, win 501, length 629
12:46:52.318137 IP 52.177.196.50.8883 > clnode190.clemson.cloudlab.us.47250: Flags [P.], seq 10564:10633, ack 61213, win 2053, length 69
12:46:52.318166 IP clnode190.clemson.cloudlab.us.47250 > 52.177.196.50.8883: Flags [.], ack 10633, win 501, length 0
12:46:52.392654 IP clnode190.clemson.cloudlab.us.47250 > 52.177.196.50.8883: Flags [P.], seq 61213:61842, ack 10633, win 501, length 629
12:46:52.418771 IP 52.177.196.50.8883 > clnode190.clemson.cloudlab.us.47250: Flags [P.], seq 10633:10702, ack 61842, win 2050, length 69
12:46:52.418800 IP clnode190.clemson.cloudlab.us.47250 > 52.177.196.50.8883: Flags [.], ack 10702, win 501, length 0
12:46:52.558930 IP clnode190.clemson.cloudlab.us.47250 > 52.177.196.50.8883: Flags [P.], seq 61842:62471, ack 10702, win 501, length 629
12:46:52.595147 IP 52.177.196.50.8883 > clnode190.clemson.cloudlab.us.47250: Flags [P.], seq 10702:10771, ack 62471, win 2048, length 69
12:46:52.595177 IP clnode190.clemson.cloudlab.us.47250 > 52.177.196.50.8883: Flags [.], ack 10771, win 501, length 0
12:46:52.655385 IP clnode190.clemson.cloudlab.us.47250 > 52.177.196.50.8883: Flags [P.], seq 62471:63100, ack 10771, win 501, length 629
12:46:52.684305 IP 52.177.196.50.8883 > clnode190.clemson.cloudlab.us.47250: Flags [P.], seq 10771:10840, ack 63100, win 2053, length 69
